Word Count,URL Count,Email Count,Sentence Count,Average Sentence Length,NumDots,UrlLength,Most Common Bigrams,NumDash,AtSymbol,NumNumericChars,RandomString,IpAddress,Lexical Diversity,POS Tags,Named Entities,Sentiment Score,Readability Score,!,"""",#,$,%,&,',(,),*,+,",",-,.,/,:,;,<,=,>,?,@,[,\,],^,_,`,{,|,},~
598,0,0,33,18.666666666666668,31,N/A,[ ]: 15; * *: 14; interested in: 7; * Persons: 5; Persons interested: 5,24,False,134,N/A,False,0.6655518394648829,"You/PRP; Ca/VBP; n't/RB; Beat/NNP; This/DT; Deal:200/NNP; Million/NNP; email/NN; addresses/NNS; Database/NNP; ,/,; On/IN; 2/CD; CDs/NNS; !/.; !/.; ==Only/RB; $/$; 99.95==100/CD; million/CD; email/NN; addresses/NNS; Database/NNP; ,/,; On/IN; CD/NNP; ==Only/RB; $/$; 69.95==1.5/CD; Million/NNP; USA/NNP; Business/NNP; FAX/NNP; NUMBERS/NNP; ,/,; On/IN; CD/NNP; ==Only/RB; $/$; 49.95==ALL/CD; THREE/NNP; DIRECTORIES/NNP; ABOVE/NNP; */NNP; */NNP; */NNP; ONLY/NNP; $/$; 139.95/CD; */NNP; */NNP; */NNP; BOTH/NNP; EMAIL/NNP; DIRECTORIES/NNP; ARE/NNP; CATEGORIZED/NNP; LIKE/NNP; :/:; */JJ; Persons/NNS; running/VBG; home/NN; businesses/NNS; or/CC; interested/JJ; in/IN; starting/VBG; one/CD; */JJ; Persons/NNPS; interested/JJ; in/IN; buying/VBG; things/NNS; on/IN; the/DT; web/NN; */NNP; Persons/NNP; interested/VBD; in/IN; investing/VBG; online/NN; or/CC; offline/VB; */CD; All/DT; 50/CD; States/NNS; broken/VBN; down/RP; by/IN; area/NN; code/NN; */NNP; Persons/NNP; interested/JJ; in/IN; Health/NNP; &/CC; Fitness/NNP; products/NNS; //NNP; services/NNS; */NNP; Opt/NNP; in/IN; :/:; Persons/NNS; interested/JJ; in/IN; recieving/VBG; offers/NNS; by/IN; email/NN; ./.; */JJ; Persons/NNPS; interested/JJ; in/IN; Travel/NNP; ,/,; Sports/NNP; ,/,; Dining/NNP; ,/,; Real/NNP; Estate/NNP; ,/,; Mortgage/NNP; ,/,; Politics/NNP; ,/,; Religion/NNP; ,/,; Fishing/NNP; ,/,; Trade/NNP; Shows/NNP; etc/FW; ../NNP; */VBD; Many/NNP; More/JJR; Categories/NNS; .../:; */NNP; */NNP; Contains/NNP; US/NNP; &/CC; International/NNP; EMAILS/NNP; */NNP; */NNP; */NNP; */NNP; Everything/NNP; on/IN; these/DT; disks/NNS; are/VBP; in/IN; TEXT/NNP; file/NN; format/NN; and/CC; fully/RB; exportable/JJ; ./.; */JJ; */JJ; */NN; */VBD; The/DT; CD/NN; is/VBZ; as/RB; easy/JJ; to/TO; use/VB; as/IN; browsing/VBG; your/PRP$; C/NNP; drive/NN; in/IN; Explorer/NNP; ./.; */VB; */RB; NOW/NNP; YOU/NNP; CAN/NNP; ADVERTISE/NNP; FREE/NNP; AND/NNP; GET/NNP; TREMENDOUSLY/NNP; MORE/NNP; RESPONSES/NNP; THAN/NNP; ADVERTISING/NN; WITH/NNP; OTHER/NNP; FORMS/NNP; OF/IN; MEDIA/NNP; !/.; !/.; ORDER/NNP; NOWHOW/NNP; THIS/NNP; DIRECTORY/NNP; WAS/NNP; COMPILED/NNP; :/:; */NN; Virtually/RB; every/DT; other/JJ; email/JJ; directory/NN; on/IN; the/DT; Internet/NNP; was/VBD; taken/VBN; and/CC; put/VBD; it/PRP; through/IN; an/DT; extensive/JJ; email/NN; verification/NN; process/NN; thus/RB; eliminating/VBG; all/PDT; the/DT; dead/JJ; addressess/NN; ./.; */CC; Special/JJ; software/NN; spiders/NNS; through/IN; the/DT; web/NN; searching/VBG; websites/NNS; ,/,; newsgroups/NNS; and/CC; many/JJ; other/JJ; online/JJ; databases/NNS; with/IN; given/VBN; keywords/NNS; like/IN; area/NN; codes/NNS; ,/,; industries/NNS; ,/,; city/NN; names/NNS; etc/VBP; ../NN; to/TO; find/VB; millions/NNS; of/IN; fresh/JJ; new/JJ; addresses/NNS; every/DT; week.TURN/NN; YOUR/NNP; COMPUTER/NNP; INTO/NNP; A/NNP; MONEY/NNP; MACHINE/NNP; !/.; Most/JJS; estimate/RB; well/RB; over/IN; 400/CD; MILLION/NNP; people/NNS; will/MD; have/VB; E-mail/NNP; accounts/NNS; in/IN; the/DT; next/JJ; 2Years/CD; !/.; E-Mail/JJ; turns/VBZ; your/PRP$; computer/NN; into/IN; a/DT; Money/NNP; Machine/NN; by/IN; giving/VBG; you/PRP; FREE/NNP; ,/,; immediate/JJ; access/NN; to/TO; all/DT; of/IN; them/PRP; ./.; Do/VBP; n't/RB; you/PRP; think/VB; some/DT; of/IN; the/DT; more/JJR; than/IN; 200/CD; million/CD; people/NNS; with/IN; E-mail/JJ; addresses/NNS; would/MD; be/VB; interested/JJ; in/IN; your/PRP$; products/NNS; or/CC; Services/NNPS; ?/.; MUCH/JJ; FASTER/NN; :/:; With/IN; bulk/JJ; E-mail/NNP; you/PRP; get/VBP; responses/NNS; back/RB; in/IN; 1/CD; to/TO; 4/CD; days/NNS; instead/RB; of/IN; waiting/VBG; weeks/NNS; or/CC; months/NNS; !/.; You/PRP; can/MD; begin/VB; filling/VBG; orders/NNS; the/DT; same/JJ; day/NN; you/PRP; send/VBP; E-mail/JJ; ./.; FREE/JJ; ADVERTISING/NN; WORTH/NNP; MILLIONS/NNP; :/:; It/PRP; costs/VBZ; millions/NNS; of/IN; dollars/NNS; to/TO; mail/NN; ./.; DO/NNP; NOT/NNP; REPLY/NNP; TO/NNP; THIS/NNP; EMAIL/NNP; ADDRESS/NNP; ./.; TO/NNP; ORDER/NNP; ,/,; READ/NNP; BELOW/NNP; :/:; */NN; */NN; ORDER/NNP; BY/NNP; CREDIT/NNP; CARD/NNP; (/(; VISA/NNP; ,/,; MASTERCARD/NNP; OR/NNP; AMERICAN/NNP; EXPRESS/NNP; )/); */VBP; */SYM; -/:; Simply/NNP; complete/VB; the/DT; order/NN; form/NN; below/IN; and/CC; fax/VB; it/PRP; back/RB; to/TO; 1-240-371-0672/JJ; Make/NNP; sure/NN; that/IN; we/PRP; have/VBP; your/PRP$; email/NN; address/NN; so/IN; that/IN; we/PRP; can/MD; send/VB; you/PRP; a/DT; reciept/NN; for/IN; your/PRP$; transaction.ORDER/NN; BY/NNP; MAIL/NNP; :/:; Print/VB; the/DT; form/NN; below/IN; and/CC; send/VB; it/PRP; together/RB; with/IN; a/DT; money/NN; order/NN; payable/JJ; to/TO; FUTURE/NNP; TECH/NNP; INTERNATIONAL/NNP; for/IN; the/DT; balance/NN; to/TO; :/:; FUTURE/NNP; TECH/NNP; INTERNATIONAL/NNP; Import/NNP; Export/NNP; Company/NNP; 1300/CD; Don/NNP; Mills/NNP; Road/NNP; Suite/NNP; 211/CD; Don/NNP; Mills/NNP; Ontario/NNP; ,/,; Canada/NNP; M3B/NNP; 2W6PLEASE/CD; DO/NNP; NOT/NNP; SEND/NNP; POSTAL/NNP; MONEY/NNP; ORDERSORDER/NNP; FORM/NNP; :/:; Please/NNP; PRINT/NNP; clearlyFull/NN; Name/NN; :/:; ________________________________________________Company/JJ; Name/NN; :/:; _____________________________________________Telephone/NN; :/:; ________________________________________________Fax/NN; :/:; ______________________________________________________Email/JJ; Address/NN; :/:; __________________________________________/JJ; */NN; REQUIRED/NNP; FIELDShipping/NNP; Address/NNP; :/:; ______________________________________________City/NN; :/:; ____________________/JJ; State/Province/NN; :/:; ________________Country/NN; :/:; _________________________ZIP/Postal/NN; :/:; _____________Shipping/NN; Options/NNS; :/:; [/VB; ]/NNP; $/$; 5.95/CD; Regular/JJ; Mail/NNP; (/(; 1/CD; -/:; 2/CD; weeks/NNS; )/); [/VBP; ]/JJ; $/$; 12.95/CD; Priority/NNP; Mail/NNP; (/(; 2-4/JJ; business/NN; days/NNS; )/); [/VBP; ]/JJ; $/$; 25.95/CD; Fedex/NNP; (/(; overnight/MD; )/); For/IN; US/NNP; &/CC; Canada/NNP; Only/NNP; -/:; Int/NNP; '/POS; l/NN; orders/NNS; extra/JJ; Product/NN; :/:; [/JJ; ]/NN; Email/NNP; Marketing/NNP; CDROM/NNP; with/IN; 100/CD; million/CD; Addresses/NNPS; $/$; 69.95/CD; USD/NNP; [/NNP; ]/$; 200/CD; MILLION/NNP; EMAIL/NNP; ADDRESSES/NNP; on/IN; 2/CD; CD/NN; 's/POS; $/$; 99.95/CD; [/NNP; ]/$; 1.5/CD; Million/NNP; USA/NNP; Business/NNP; Fax/NNP; Numbers/NNP; $/$; 49.95/CD; USD/NNP; [/NNP; ]/NNP; COMBO/NNP; PACKAGE/NNP; -/:; ALL/DT; DIRECTORIES/NNP; ABOVE/NNP; (/(; 3/CD; CD/NNP; 's/POS; )/); $/$; 139.95/CD; USD/NNP; TOTAL/NNP; :/:; $/$; _________/CD; USD======================================================================================/NNP; [/NNP; ]/NNP; Credit/NNP; Card/NNP; Order/NNP; [/NNP; ]/NNP; Mail/NNP; OrderCREDIT/NNP; CARD/NNP; ORDERS/NNP; FAX/NNP; THIS/NNP; ORDER/NNP; FORM/NNP; BACK/NNP; TO/NNP; 1-240-371-0672/CD; Card/NNP; #/#; :/:; ___________________________________________________Expiry/NN; Date/NN; :/:; ______________/JJ; Type/NNP; of/IN; Card/NNP; [/NNP; ]/NNP; VISA/NNP; [/NNP; ]/NNP; MASTERCARD/NNP; [/NNP; ]/JJ; AMERICAN/NNP; EXPRESSName/NNP; on/IN; Card/NNP; :/:; _____________________________________________Billing/VBG; Address/NN; :/:; _________________________________ZIP/Postal/JJ; :/:; ____________City/NN; :/:; _____________________State/Province/NN; :/:; _______________/JJ; Country/NN; :/:; _____________Last/JJ; 3/CD; digits/NNS; on/IN; reverse/NN; of/IN; card/NN; next/IN; to/TO; signature/NN; :/:; [/NN; ]/SYM; -/:; [/NN; ]/SYM; -/:; [/NN; ]/JJ; Cardholder/NNP; Signature/NN; :/:; ______________________________________Please/NN; note/NN; that/IN; FT/NNP; International/NNP; will/MD; appear/VB; on/IN; your/PRP$; statement.=======================================================================================For/NN; any/DT; questions/NNS; please/VBP; feel/VB; free/JJ; to/TO; call/VB; us/PRP; at/IN; 1-416-410-9364To/JJ; be/VB; removed/VBN; from/IN; our/PRP$; database/NN; please/VB; send/VB; a/DT; fax/NN; to/TO; 1-970-289-6524/JJ",N/A,0.9949,53.21,7,0,1,12,0,3,5,5,5,33,0,18,24,31,5,33,0,0,185,0,1,0,15,0,15,0,608,0,0,0,0,0,Unknown
72,0,0,7,9.285714285714286,0,N/A,your girl: 2; any med: 1; med for: 1; for your: 1; girl to: 1,0,True,0,N/A,False,0.7916666666666666,"any/DT; med/VBD; for/IN; your/PRP$; girl/NN; to/TO; be/VB; happy/JJ; !/.; your/PRP$; girl/NN; is/VBZ; unsatisfied/JJ; with/IN; your/PRP$; potency/NN; ?/.; don/NN; '/''; t/JJ; wait/NN; until/IN; she/PRP; finds/VBZ; another/DT; men/NNS; !/.; click/NN; here/RB; to/TO; choose/VB; from/IN; a/DT; great/JJ; variety/NN; of/IN; llcensed/JJ; love/NN; t/NN; @/NNP; bs/NN; !/.; best/JJS; pri/JJ; $/$; es/NN; ,/,; fast/JJ; shippinq/NN; and/CC; guaranteed/JJ; effect/NN; !/.; here/RB; you/PRP; buy/VBP; it/PRP; riqht/VBZ; from/IN; warehouse/NN; !/.; the/DT; store/NN; is/VBZ; verified/VBN; by/IN; bbb/NN; and/CC; approved/VBN; by/IN; visa/NN; !/.",N/A,0.9611,88.02,6,0,0,1,0,0,1,0,0,0,0,1,0,0,0,0,0,0,0,0,1,1,0,0,0,0,0,0,0,0,0,0,Unknown
1,0,0,0,0,0,N/A,,0,False,0,N/A,False,1.0,empty/JJ,N/A,-0.2023,36.62,0,0,0,0,0,0,0,0,0,0,0,0,0,0,0,0,0,0,0,0,0,0,0,0,0,0,0,0,0,0,0,0,Unknown
12,0,0,0,0,0,N/A,Accept Credit: 1; Credit Cards: 1; Cards -: 1; - Everyone: 1; Everyone Approved: 1,1,False,22,N/A,False,1.0,Accept/NNP; Credit/NNP; Cards/NNP; -/:; Everyone/NN; Approved/VBD; NO/NNP; CREDIT/NNP; CHECKSDO/NNP; IT/NNP; NOW/NNP; 3115107654333222221111/CD,N/A,0.8126,60.31,0,0,0,0,0,0,0,0,0,0,0,0,1,0,0,0,0,0,0,0,0,0,0,0,0,0,0,0,0,0,0,0,Unknown
544,0,0,45,12.511111111111111,44,N/A,", and: 8; you can: 6; that is: 3; . We: 3; We are: 3",12,True,40,N/A,False,0.5367647058823529,"Hello/NNP; -You/NNP; get/VBP; emails/JJ; every/DT; day/NN; ,/,; offering/VBG; to/TO; show/VB; you/PRP; how/WRB; to/TO; make/VB; money/NN; ./.; Most/JJS; of/IN; these/DT; emails/NNS; are/VBP; from/IN; people/NNS; who/WP; are/VBP; NOT/NNP; making/VBG; any/DT; money/NN; ./.; And/CC; they/PRP; expect/VBP; you/PRP; to/TO; listen/VB; to/TO; them/PRP; ?/.; Enough.If/NNP; you/PRP; want/VBP; to/TO; make/VB; money/NN; with/IN; your/PRP$; computer/NN; ,/,; then/RB; you/PRP; should/MD; hook/VB; up/RP; with/IN; a/DT; group/NN; that/WDT; is/VBZ; actually/RB; DOING/NNP; it/PRP; ./.; We/PRP; are/VBP; making/VBG; a/DT; large/JJ; ,/,; continuing/JJ; income/NN; every/DT; month/NN; ./.; What/WP; 's/VBZ; more/JJR; -/:; we/PRP; will/MD; show/VB; YOU/NNP; how/WRB; to/TO; do/VB; the/DT; same/JJ; thing.This/NN; business/NN; is/VBZ; done/VBN; completely/RB; by/IN; internet/NN; and/CC; email/NN; ,/,; and/CC; you/PRP; can/MD; even/RB; join/VB; for/IN; free/JJ; to/TO; check/VB; it/PRP; out/RP; first/RB; ./.; If/IN; you/PRP; can/MD; send/VB; an/DT; email/NN; ,/,; you/PRP; can/MD; do/VB; this/DT; ./.; No/DT; special/JJ; ``/``; skills/NNS; ''/''; are/VBP; required.How/JJ; much/JJ; are/VBP; we/PRP; making/VBG; ?/.; Anywhere/RB; from/IN; $/$; 500/CD; to/TO; $/$; 9000/CD; per/IN; month/NN; ./.; We/PRP; are/VBP; real/JJ; people/NNS; ,/,; and/CC; most/JJS; of/IN; us/PRP; work/VBP; at/IN; this/DT; business/NN; part-time/NN; ./.; But/CC; keep/VB; in/IN; mind/NN; ,/,; we/PRP; do/VBP; WORK/VB; at/IN; it/PRP; -/:; I/PRP; am/VBP; not/RB; going/VBG; to/TO; insult/VB; your/PRP$; intelligence/NN; by/IN; saying/VBG; you/PRP; can/MD; sign/VB; up/RP; ,/,; do/VB; no/DT; work/NN; ,/,; and/CC; rake/VB; in/IN; the/DT; cash/NN; ./.; That/DT; kind/NN; of/IN; job/NN; does/VBZ; not/RB; exist/VB; ./.; But/CC; if/IN; you/PRP; are/VBP; willing/JJ; to/TO; put/VB; in/IN; 10-12/JJ; hours/NNS; per/IN; week/NN; ,/,; this/DT; might/MD; be/VB; just/RB; the/DT; thing/NN; you/PRP; are/VBP; looking/VBG; for.This/NN; is/VBZ; not/RB; income/NN; that/WDT; is/VBZ; determined/VBN; by/IN; luck/NN; ,/,; or/CC; work/NN; that/WDT; is/VBZ; done/VBN; FOR/IN; you/PRP; -/:; it/PRP; is/VBZ; all/DT; based/VBN; on/IN; your/PRP$; effort/NN; ./.; But/CC; ,/,; as/IN; I/PRP; said/VBD; ,/,; there/EX; are/VBP; no/DT; special/JJ; skills/NNS; required/VBN; ./.; And/CC; this/DT; income/NN; is/VBZ; RESIDUAL/NNP; -/:; meaning/NN; that/IN; it/PRP; continues/VBZ; each/DT; month/NN; (/(; and/CC; it/PRP; tends/VBZ; to/TO; increase/VB; each/DT; month/NN; also/RB; )/); .Interested/VBD; ?/.; I/PRP; invite/VBP; you/PRP; to/TO; find/VB; out/RP; more/JJR; ./.; You/PRP; can/MD; get/VB; in/IN; as/IN; a/DT; free/JJ; member/NN; ,/,; at/IN; no/DT; cost/NN; ,/,; and/CC; no/DT; obligation/NN; to/TO; continue/VB; if/IN; you/PRP; decide/VBP; it/PRP; is/VBZ; not/RB; for/IN; you/PRP; ./.; We/PRP; are/VBP; just/RB; looking/VBG; for/IN; people/NNS; who/WP; still/RB; have/VBP; that/IN; ``/``; burning/VBG; desire/NN; ''/''; to/TO; find/VB; an/DT; opportunity/NN; that/WDT; will/MD; reward/VB; them/PRP; incredibly/RB; well/RB; ,/,; if/IN; they/PRP; work/VBP; at/IN; it.To/JJ; grab/VBP; a/DT; FREE/NNP; ID/NNP; #/#; ,/,; simply/RB; reply/VB; to/TO; :/:; sj95/NN; @/NNP; yahoo.com/NN; and/CC; in/IN; the/DT; body/NN; of/IN; the/DT; email/NN; ,/,; write/VB; this/DT; phrase/NN; :/:; ''/''; Tim/NNP; ,/,; enter/NN; my/PRP$; name/NN; for/IN; a/DT; free/JJ; membership/NN; ./.; ``/``; Be/JJ; sure/JJ; to/TO; include/VB; your/PRP$; :/:; 1/CD; ./.; First/NNP; name/NN; 2/CD; ./.; Last/JJ; name/NN; 3/CD; ./.; Email/NNP; address/NN; (/(; if/IN; different/JJ; from/IN; above/IN; )/); We/PRP; will/MD; confirm/VB; your/PRP$; position/NN; and/CC; send/VB; you/PRP; a/DT; special/JJ; report/NN; as/RB; soon/RB; as/IN; possible/JJ; ,/,; and/CC; also/RB; Your/PRP$; free/JJ; Member/NNP; Number.That/NNP; 's/POS; all/DT; there/EX; 's/VBZ; to/TO; it.We/VB; 'll/MD; then/RB; send/VB; you/PRP; info/VB; ,/,; and/CC; you/PRP; can/MD; make/VB; up/RP; your/PRP$; own/JJ; mind.Looking/VBG; forward/RB; to/TO; hearing/VBG; from/IN; you/PRP; !/.; Sincerely/RB; ,/,; Tim/NNP; HopkinsP.S/NNP; ./.; After/IN; having/VBG; several/JJ; negative/JJ; experiences/NNS; with/IN; network/NN; marketing/NN; companies/NNS; I/PRP; had/VBD; pretty/RB; much/JJ; given/VBN; up/RP; on/IN; them/PRP; ./.; This/DT; is/VBZ; different/JJ; -/:; there/EX; is/VBZ; value/NN; ,/,; integrity/NN; ,/,; and/CC; a/DT; REAL/JJ; opportunity/NN; to/TO; have/VB; your/PRP$; own/JJ; home-based/JJ; business/NN; .../:; and/CC; finally/RB; make/VB; real/JJ; money/NN; on/IN; the/DT; internet.Do/NN; n't/RB; pass/VBD; this/DT; up/RP; ../IN; you/PRP; can/MD; sign/VB; up/RP; and/CC; test-drive/JJ; the/DT; program/NN; for/IN; FREE/NNP; ./.; All/NNP; you/PRP; need/VBP; to/TO; do/VB; is/VBZ; get/VB; your/PRP$; free/JJ; membership.Unsubscribing/NN; :/:; Send/VB; a/DT; blank/JJ; email/NN; to/TO; :/:; sj95/NN; @/VBZ; yahoo.com/NN; with/IN; ''/''; Remove/NNP; ''/''; in/IN; the/DT; subject/JJ; line/NN; ./.; By/IN; submitting/VBG; a/DT; request/NN; for/IN; a/DT; FREE/NNP; DHS/NNP; Club/NNP; Membership/NNP; ,/,; I/PRP; agree/VBP; to/TO; accept/VB; email/NN; from/IN; the/DT; DHS/NNP; Club/NNP; for/IN; both/DT; their/PRP$; consumer/NN; and/CC; business/NN; opportunities.This/NN; message/NN; is/VBZ; not/RB; intended/VBN; for/IN; residents/NNS; of/IN; the/DT; state/NN; of/IN; Washington/NNP; ,/,; and/CC; screening/NN; of/IN; addresses/NNS; has/VBZ; been/VBN; done/VBN; to/TO; the/DT; best/JJS; of/IN; our/PRP$; technical/JJ; ability/NN; ./.; If/IN; you/PRP; are/VBP; Washington/NNP; resident/NN; or/CC; otherwise/RB; wish/JJ; to/TO; be/VB; removed/VBN; from/IN; this/DT; list/NN; ,/,; just/RB; follow/VB; the/DT; removal/NN; instructions/NNS; above/IN; ./.; 6184JQYf9-897vxaf2019nLAS2-399wyqF8426JMcl39/JJ",N/A,0.9987,75.4,1,8,1,2,0,0,5,2,2,0,0,27,12,44,0,5,0,0,0,0,3,2,0,0,0,0,0,0,0,0,0,0,Unknown
133,0,0,8,17.625,10,N/A,Plans For: 4; Dental Plans: 3; For $: 2; $ 6.95: 2; 6.95 Per: 2,5,True,38,N/A,False,0.7593984962406015,"Dental/JJ; Plans/NNPS; For/IN; $/$; 6.95/CD; Per/NNP; Month/NNP; Dental/NNP; Plans/VBZ; For/IN; $/$; 6.95/CD; Per/NNP; Month/NNP; Dental/NNP; Plans/VBZ; For/IN; You/PRP; And/CC; Your/VB; Entire/NNP; Family/NNP; A/NNP; Variety/NNP; Of/IN; Plan/NNP; Choices/NNP; NationwideDental/NNP; Plans/VBZ; For/IN; Individuals/NNS; and/CC; Employer/NNP; GroupsYou/NNP; can/MD; choose/VB; from/IN; traditional/JJ; dental/JJ; insurance/NN; that/WDT; lets/VBZ; you/PRP; see/VBP; any/DT; dentist/NN; you/PRP; wish/VBP; ,/,; or/CC; if/IN; you/PRP; do/VBP; not/RB; have/VB; your/PRP$; own/JJ; private/JJ; dentist/NN; ,/,; choose/VBP; one/CD; of/IN; our/PRP$; plans/NNS; that/WDT; offer/VBP; dental/JJ; coverage/NN; fromֳ‚ֲ/VBD; pre-screened/JJ; dental/JJ; offices/NNS; and/CC; save/VB; hundreds/NNS; of/IN; dollars/NNS; on/IN; your/PRP$; dental/JJ; treatment.Dental/JJ; Plans/NNS; With/IN; No/DT; Deductibles.Dental/NNP; Plans/VBZ; That/IN; Cover/NNP; OrthodonticsShould/NNP; You/PRP; Need/VBP; To/TO; See/VB; A/NNP; Dentist/NNP; Right/NNP; Away/NNP; .../:; To/TO; Compare/NNP; Plans/NNPS; Benefits/NNP; And/CC; Rates/NNP; ,/,; Click/NNP; HereTo/NNP; be/VB; removed/VBN; from/IN; this/DT; emailing/VBG; list/NN; ,/,; please/VB; reply/VB; to/TO; this/DT; message/NN; by/IN; clicking/VBG; on/IN; REMOVEFirst/NNP; American/NNP; Dental/NNP; Planswww.firstdentalplans.com/NNP; To/TO; contact/VB; us/PRP; :/:; Phone/NN; :/:; 800-711-8817Fax/JJ; :/:; 800-752-4040Email/JJ; :/:; sales/NNS; @/VBP; firstdentalplans.com1525/JJ; Mesa/NNP; Verde/NNP; East/NNP; ,/,; Suite/NNP; 107Costa/CD; Mesa/NNP; ,/,; CAֳ‚ֲ/NNP; 92626/CD",N/A,0.8225,54.63,0,0,0,2,0,0,0,0,0,0,0,6,5,10,0,4,0,0,0,0,0,1,0,0,0,0,0,0,0,0,0,0,Unknown
78,0,0,5,16.4,3,N/A,our website: 2; ? ?: 2; Dear Sir: 1; Sir /: 1; / MadamIf: 1,0,False,17,N/A,False,0.8461538461538461,"Dear/NNP; Sir/NNP; //NNP; MadamIf/NNP; you/PRP; are/VBP; fed/VBN; up/IN; of/IN; being/VBG; 'ripped/VBN; off/RP; '/''; by/IN; the/DT; British/JJ; government/NN; every/DT; time/NN; you/PRP; buy/VBP; your/PRP$; tobacco/NN; ,/,; then/RB; you/PRP; should/MD; visit/VB; our/PRP$; website/NN; ,/,; where/WRB; you/PRP; can/MD; now/RB; buy/VB; 4/CD; cartons/NNS; of/IN; cigarettes/NNS; ,/,; or/CC; 40/CD; pouches/NNS; of/IN; rolling/VBG; tobacco/NN; from/IN; as/RB; little/JJ; as/IN; 170/CD; Euros/NNP; (/(; approx/JJ; 105/CD; pounds/NNS; )/); ,/,; inclusive/JJ; of/IN; delivery/NN; by/IN; registered/JJ; air/NN; mail/NN; from/IN; our/PRP$; office/NN; in/IN; Spain/NNP; ./.; Why/WRB; pay/NN; more/JJR; ?/.; ?/.; ?/.; Visit/VB; our/PRP$; website/NN; at/IN; http/NN; :/:; //www.cheapsmoking.com//NN; ?/.; ID=2Best/NNP; regards/NNS; Sales/NNS; Department/NNP; Cheap/NNP; Smoking/NNP; Spain/NNP; xay1992361y/NN",N/A,0.4871,60.35,0,0,0,0,0,0,2,1,1,0,0,4,0,3,4,1,0,0,1,0,4,0,0,0,0,0,0,0,0,0,0,0,Unknown
139,0,0,23,5.217391304347826,19,N/A,- -: 4; . .: 3; charge $: 2; a .: 2; - v: 2,11,False,9,N/A,False,0.5611510791366906,"maybe/RB; this/DT; might/MD; interest/NN; you/PRP; ge/VBP; //JJ; n/JJ; //NN; e/NN; //NNP; r/NN; //NNP; ic/NN; ci/NN; //VBZ; a/DT; //JJ; l/NN; //NN; is/VBZ; ,/,; at/IN; cheap/JJ; prices/NNS; ./.; most/JJS; places/NNS; charge/VBP; $/$; 20/CD; ,/,; we/PRP; charge/VBP; $/$; 1/CD; ./.; quite/VB; a/DT; difference/NN; ./.; ci/NN; ./.; a/DT; ./.; li/NN; ./.; s/NN; is/VBZ; known/VBN; as/IN; a/DT; sup/NN; ./.; er/CC; -/:; v/NN; ?/.; a/DT; ./.; g/NN; ./.; ra/NN; or/CC; weekend/NN; -/:; v/NN; ?/.; ag/NN; ./.; ./.; ra/NN; because/IN; its/PRP$; effects/NNS; start/VBP; sooner/NN; and/CC; last/JJ; much/JJ; longer/JJR; ./.; shipped/VBN; worldwide/NN; ./.; your/PRP$; easy/JJ; -/:; to/TO; -/:; use/NN; solution/NN; is/VBZ; here/RB; :/:; http/NN; :/:; //JJ; //NNP; ejrhxw/NN; 322/CD; ./.; com/NN; //JJ; free/JJ; //NN; ?/.; sash/NN; -/:; -/:; -/:; -/:; -/:; the/DT; link/NN; below/NN; is/VBZ; for/IN; those/DT; who/WP; hate/VBP; spam/NNS; ./.; ./.; ./.; http/NN; :/:; //JJ; //NNP; ejrhxw/NN; 322/CD; ./.; com/NN; //JJ; rm/NN; ./.; php/NN; ?/.; sash/JJ; -/:; =/NN; =/SYM; -/:",N/A,0.7399,104.34,0,0,0,2,0,0,0,0,0,0,0,2,11,19,14,3,0,0,2,0,4,0,0,0,0,0,0,0,0,0,0,0,Unknown
41,0,0,1,40.0,0,N/A,need low: 1; low priced: 1; priced software: 1; software ?: 1; ? indents: 1,0,False,0,N/A,False,1.0,need/RB; low/JJ; priced/VBN; software/NN; ?/.; indents/NNS; selectivity/NN; deliver/RB; artemia/RB; belatedly/RB; by/IN; concentrate/JJ; eclectic/JJ; cabled/VBD; gunners/NNS; nyquist/JJ; correlation/NN; disfigure/NN; aborigines/VBZ; redevelopment/JJ; levelness/NN; meals/NNS; superimposed/VBD; allergies/NNS; shading/VBG; entree/JJ; strainer/NN; espouse/NN; syndicates/VBZ; augmenting/VBG; simpleton/NN; erratum/NN; kite/NN; summing/VBG; person/NN; fluffier/NN; overloaded/VBD; warningly/RB; ascensions/NNS; huddled/VBD; burglarproofs/NN,N/A,-0.4404,-16.51,0,0,0,0,0,0,0,0,0,0,0,0,0,0,0,0,0,0,0,0,1,0,0,0,0,0,0,0,0,0,0,0,Unknown
168,0,0,17,8.882352941176471,15,N/A,- -: 4; if you: 2; wear a: 2; charge $: 2; http :: 2,9,False,5,N/A,False,0.6130952380952381,"explore/RB; vip/SYM; -/:; only/RB; super/VBZ; viagrka/NN; !/.; ;/:; -/:; )/); a/DT; circumscribed/NN; nummulated/VBN; multisensual/JJ; ./.; hello/NN; ,/,; chief/NN; :/:; )/); if/IN; you/PRP; are/VBP; a/DT; dog/NN; and/CC; your/PRP$; owner/NN; suggests/VBZ; that/IN; you/PRP; wear/VBP; a/DT; sweater/NN; suggest/NN; that/IN; he/PRP; wear/VB; a/DT; tail/NN; ./.; cialius/NN; (/(; regalils/NNS; )/); ,/,; at/IN; cheap/JJ; prices/NNS; ./.; most/JJS; sites/JJ; charge/VBP; $/$; 20/CD; ,/,; we/PRP; charge/VBP; $/$; 4/CD; ./.; 95/CD; ./.; quite/VB; a/DT; differeence/NN; ./.; cialifs/NN; is/VBZ; knnown/VBN; as/IN; a/DT; super/JJ; viagrja/NN; or/CC; weekend/NN; viagrea/NN; because/IN; its/PRP$; eecftfs/JJ; start/NN; sooner/NN; and/CC; last/JJ; much/JJ; lneogr/NN; ./.; shipped/VBN; worldwide/NN; ./.; your/PRP$; easy/JJ; -/:; to/TO; -/:; use/NN; solution/NN; is/VBZ; here/RB; :/:; http/NN; :/:; //JJ; //NNP; www/NN; ./.; wowmedz/NN; ./.; biz/NN; //JJ; cia/NN; //NN; ?/.; dcent/NN; -/:; -/:; -/:; -/:; -/:; if/IN; you/PRP; do/VBP; not/RB; wish/VB; to/TO; be/VB; gorillaship/JJ; ;/:; )/); one/CD; of/IN; the/DT; vices/NNS; of/IN; the/DT; virtue/NN; of/IN; decentralization/NN; is/VBZ; that/IN; people/NNS; don/VBP; '/''; t/JJ; share/NN; ideas/NNS; ./.; http/NN; :/:; //JJ; //NNP; www/NN; ./.; wowmedz/NN; ./.; biz/VB; //JJR; off/RP; ./.; htmlthe/VB; one/CD; who/WP; loves/VBZ; least/JJS; controls/NNS; the/DT; relationship/NN; ./.",N/A,0.972,76.42,1,0,0,2,0,0,1,1,4,0,0,3,9,15,7,4,2,0,0,0,1,0,0,0,0,0,0,0,0,0,0,0,Unknown
189,0,0,14,12.5,13,N/A,49 p: 3; vo 4: 2; p 26: 2; mq 3: 2; 6 q: 2,0,False,76,N/A,False,0.5873015873015873,"never/RB; see/VB; a/DT; doctor/NN; again/RB; to/TO; get/VB; the/DT; medocations/NNS; you/PRP; want/VBP; vo/JJ; 4/CD; 8/CD; ub/JJ; u/JJ; 49/CD; p/NN; 26/CD; oiy/NN; 7/CD; pm/NN; 6/CD; 8/CD; mq/NN; 3/CD; bf/NN; 6/CD; q/NN; 8/CD; f/NN; 2/CD; 3/CD; s/NN; 3/CD; k/NN; 94/CD; jw/NN; ./.; why/WRB; pay/NN; doctors/NNS; to/TO; tell/VB; you/PRP; what/WP; you/PRP; already/RB; want/VB; ?/.; v/NN; i/VBZ; a/DT; g/NN; r/NN; a/DT; ./.; ./.; ./.; 7/CD; x/JJ; 7/CD; ouu/JJ; 9/CD; rjorx/NN; oyla/NN; 6/CD; typl/NN; 1/CD; 9/CD; zu/NN; 25/CD; so/RB; 03/CD; z/NN; 76/CD; f/NN; ./.; more/JJR; $/$; a/DT; \/NNP; //NNP; ings/NNS; then/RB; you/PRP; think/VBP; ,/,; press/NN; ./.; noq/JJ; timl/NN; 814/CD; ko/NN; jjqb/NN; t/NN; xi/VBD; 578/CD; ubu/JJ; 49/CD; p/NN; 26/CD; o/NN; iy/NN; 7/CD; p/NN; ./.; m/CC; 68/CD; mq/NN; 3/CD; b/NN; f/NN; 6/CD; q/NN; 8/CD; f/NN; 23/CD; s/NN; 3/CD; k/NN; 94/CD; jwr/NN; g/NN; 7/CD; x/NN; 70/CD; uu/JJ; 9/CD; r/NN; jorx/NN; ./.; but/CC; at/IN; that/DT; moment/NN; i/NN; glanced/VBD; round/NN; at/IN; the/DT; crowd/NN; that/WDT; had/VBD; followed/VBN; me/PRP; ./.; t/VB; 4/CD; v/JJ; 5/CD; jkl/NN; 2/CD; vvl/NN; 0/CD; vo/NN; 4/CD; 15/CD; gg/NN; f/VBD; 9/CD; m/NN; 13/CD; gn/NN; 3/CD; ./.; no/DT; ./.; that/WDT; would/MD; never/RB; do/VB; ./.; dq/VB; timl/JJ; 814/CD; koj/NN; jqbt/NN; xi/VBD; 5/CD; 78/CD; ubu/JJ; 49/CD; p/NN; 2/CD; ./.; m/VB; 68/CD; mq/NN",N/A,0.5719,99.26,0,0,0,1,0,0,0,0,0,0,0,1,0,13,1,0,0,0,0,0,1,0,0,1,0,0,0,0,0,0,0,0,Unknown
46,0,0,3,14.333333333333334,2,N/A,click here: 1; here to: 1; to improve: 1; improve your: 1; your wellbeing: 1,0,False,0,N/A,False,0.8260869565217391,"click/NN; here/RB; to/TO; improve/VB; your/PRP$; wellbeing/VBG; today/NN; your/PRP$; one/CD; stop/NN; prescription/NN; shop/NN; !/.; there/EX; are/VBP; more/RBR; pleasant/JJ; things/NNS; to/TO; do/VB; than/IN; beat/VB; up/RP; people/NNS; ./.; benson/NN; ,/,; you/PRP; are/VBP; so/RB; free/JJ; of/IN; the/DT; ravages/NNS; of/IN; intelligence/NN; of/IN; those/DT; who/WP; say/VBP; nothing/NN; ,/,; few/JJ; are/VBP; silent/JJ; ./.",N/A,0.9174,82.95,1,0,0,0,0,0,0,0,0,0,0,2,0,2,0,0,0,0,0,0,0,0,0,0,0,0,0,0,0,0,0,0,Unknown
