Word Count,URL Count,Email Count,Sentence Count,Average Sentence Length,NumDots,UrlLength,Most Common Bigrams,NumDash,AtSymbol,NumNumericChars,RandomString,IpAddress,Lexical Diversity,POS Tags,Named Entities,Sentiment Score,Readability Score,!,"""",#,$,%,&,',(,),*,+,",",-,.,/,:,;,<,=,>,?,@,[,\,],^,_,`,{,|,},~
91,0,0,17,5.9411764705882355,12,N/A,! !: 3; ! http: 2; http :: 2; More Than: 1; Than $: 1,6,True,6,N/A,False,0.8791208791208791,More/JJR; Than/NNP; $/$; 2500/CD; in/IN; DEBT/NNP; ?/.; We/PRP; Can/MD; Help/VB; You/PRP; PAY-OFF/VB; Your/PRP$; BILLS/NN; !/.; !/.; Click/NNP; here/RB; for/IN; your/PRP$; FREE/JJ; Consultation/NN; !/.; !/.; http/NN; :/:; //www.cash-refund.com/~Cut/JJ; your/PRP$; monthly/JJ; payments/NNS; by/IN; 50/CD; %/NN; or/CC; even/RB; more/JJR; .../:; ~Stop/NN; paying/VBG; Creditors/NNS; high/JJ; interest/NN; rates/NNS; ?/.; ~Better/JJ; Manage/NNP; your/PRP$; Financial/NNP; Situation/NN; .../:; Keep/NNP; More/JJR; Cash/JJ; every/DT; Month/NN; !/.; ~We/NN; can/MD; Help/VB; STOP/VB; any/DT; Creditor/NNP; Harassment/NN; !/.; ~Consolidate/JJ; Regardless/NNP; of/IN; past/JJ; Credit/NNP; History/NN; !/.; Quick/NNP; -/:; Confidential/NNP; -/:; No/DT; Obligations/NNP; -/:; Click/NN; on/IN; the/DT; link/NN; below/IN; to/TO; get/VB; started/JJ; !/.; !/.; http/NN; :/:; //www.cash-refund.com/~~~~~~~~~~~~~~~~~~~~~~~~~~~~~~~~~~~~~~~~~~~~~~~If/JJ; this/DT; message/NN; has/VBZ; reached/VBN; you/PRP; in/IN; error/NN; and/CC; you/PRP; wish/VBP; to/TO; be/VB; removed/VBN; from/IN; our/PRP$; mailing/VBG; list/NN; please/NN; click/VB; this/DT; link/NN; :/:; mailto/NN; :/:; debtgone/NN; @/NN; btamail.net.cn/NN; ?/.; subject=Remove/VB,N/A,0.8935,54.9,9,0,0,1,1,0,0,0,0,0,0,0,6,12,6,4,0,0,1,0,3,1,0,0,0,0,0,0,0,0,0,52,Unknown
287,0,0,5,56.4,4,N/A,- -: 16; anywhere in: 4; in the: 4; the world: 4; ' s: 3,25,False,8,N/A,False,0.5505226480836237,the/DT; worlds/NNS; most/RBS; dangerous/JJ; book/NN; -/:; brainchild/NN; binge/IN; the/DT; players/NNS; guide/VBP; handbook/NN; is/VBZ; probably/RB; the/DT; most/RBS; revolutionary/JJ; ebook/NN; to/TO; be/VB; offered/VBN; for/IN; sale/NN; anywhere/RB; in/IN; the/DT; world/NN; ./.; discover/VB; the/DT; secrets/NNS; your/PRP$; government/NN; doesn/NN; '/''; t/NN; want/VBP; you/PRP; to/TO; know/VB; ./.; already/RB; one/CD; politician/NN; has/VBZ; tried/VBN; his/PRP$; hardest/NN; to/TO; silence/VB; this/DT; '/POS; explosive/JJ; and/CC; dangerous/JJ; '/''; book/NN; ./.; here/RB; '/''; s/JJ; why/WRB; :/:; the/DT; secret/JJ; players/NNS; guide/VBP; is/VBZ; probably/RB; the/DT; most/RBS; revolutionary/JJ; book/NN; to/TO; be/VB; offered/VBN; for/IN; sale/NN; anywhere/RB; in/IN; the/DT; world/NN; ./.; discover/VB; the/DT; secrets/NNS; your/PRP$; governments/NNS; don/VBP; '/''; t/NN; want/VBP; you/PRP; to/TO; know/VB; here/RB; '/''; s/VBP; a/DT; sample/NN; of/IN; what/WP; '/''; s/JJ; inside/IN; :/:; the/DT; quick/JJ; start/NN; guide/NN; to/TO; offshore/VB; banking/NN; -/:; -/:; -/:; open/JJ; 5/CD; offshore/NN; accounts/NNS; todayhow/VBP; to/TO; keep/VB; all/DT; your/PRP$; money/NN; -/:; -/:; -/:; stop/NN; losing/NN; 1000/CD; s/NN; in/IN; tax/NN; open/JJ; anonymous/JJ; merchant/NN; accounts/NNS; -/:; -/:; -/:; accept/VB; credit/NN; cards/NNS; from/IN; anywhere/RB; in/IN; the/DT; world/NN; how/WRB; to/TO; get/VB; anonymous/JJ; visa/NNS; and/CC; mastercard/NN; credit/NN; cards/NNS; -/:; -/:; -/:; get/VB; both/DT; today/NN; how/WRB; to/TO; set/VB; up/RP; discreet/JJ; mail/NN; drops/NNS; in/IN; over/IN; 100/CD; countries/NNS; -/:; -/:; -/:; these/DT; cost/NN; next/IN; to/TO; nothing/NN; to/TO; set/VB; up/RP; and/CC; no/DT; one/NN; can/MD; find/VB; you/PRP; find/VBP; anyone/NN; anywhere/RB; -/:; -/:; -/:; track/NN; and/CC; trace/NN; anyone/NN; today/NN; repair/VB; your/PRP$; credit/NN; -/:; -/:; -/:; bad/JJ; credit/NN; ?/.; repair/NN; it/PRP; today/NN; telephone/NN; calls/VBZ; for/IN; free/JJ; -/:; -/:; -/:; make/VB; telephone/NN; calls/NNS; to/TO; anywhere/VB; in/IN; the/DT; world/NN; today/NN; get/VB; them/PRP; now/RB; before/IN; your/PRP$; goverment/NN; bans/VBZ; them/PRP; if/IN; you/PRP; would/MD; prefer/VB; not/RB; to/TO; recieve/VB; these/DT; messages/NNS; check/VBP; here/RB; notate/JJ; callus/NN; sago/NN; eeoc/NN; torah/NN; alice/NN; vaudeville/NN; seashore/VBD; hawthorne/JJ; detriment/NN; son/NN; paraboloidal/JJ; religiosity/NN; concoct/NN; hydroxyl/NN; hemlock/NN; bach/NN; ann/IN; macromolecular/JJ; tuscan/JJ; coccidiosis/NN; frostbitten/VBD; dogmatism/NN; diffuse/NN; charcoal/NN; ibex/NN; dunlap/NN; carrot/NN; portage/NN; familism/NN; soybean/JJ; coventry/NN; dapper/NN; furthermost/NN; communique/NN; anaplasmosis/NN,N/A,-0.0992,38.02,0,0,0,0,0,0,7,0,0,0,0,0,25,4,0,2,0,0,0,0,1,0,0,0,0,0,0,0,0,0,0,0,Unknown
1116,0,0,83,12.44578313253012,76,N/A,10 /: 10; / 100: 10; refurb /: 10; / 90: 10; 90 days: 10,38,True,381,N/A,False,0.3835125448028674,"toshiba/JJ; manufacturer/NN; refurbished/VBD; notebooks/RB; toshibafactory/JJ; refurbishednotebooks/NNS; ``/``; deals/NNS; of/IN; the/DT; week/NN; ``/``; (/(; see/VB; below/IN; toshiba/NNS; )/); refurbs/VBP; save/JJ; cash/NN; !/.; why/WRB; hesitate/NN; getting/VBG; the/DT; best/JJS; value/NN; by/IN; getting/VBG; the/DT; exact/JJ; same/JJ; equipment/NN; ,/,; with/IN; original/JJ; manufacturers/NNS; warranty/VBP; at/IN; a/DT; much/RB; lower/JJR; price/NN; ./.; money/NN; back/RB; guarantee/NN; ,/,; if/IN; you/PRP; are/VBP; not/RB; satisfied/JJ; -/:; valid/NN; for/IN; 7/CD; days/NNS; only/RB; ./.; q/NN; :/:; what/WP; is/VBZ; considered/VBN; factory/NN; refurbished/VBN; ?/.; a/DT; :/:; there/EX; are/VBP; lots/NNS; of/IN; things/NNS; that/WDT; can/MD; label/VB; items/NNS; factory/NN; refurbished/VBN; ./.; some/DT; are/VBP; so/RB; frivolous/JJ; ,/,; its/PRP$; laughable/JJ; ./.; but/CC; because/IN; consumer/NN; laws/NNS; prevent/VBP; manufacturers/NNS; from/IN; selling/VBG; anything/NN; considered/VBN; factory/NN; refurbished/VBN; as/IN; ``/``; new/JJ; ``/``; ,/,; the/DT; second/JJ; consumer/NN; gets/VBZ; the/DT; best/JJS; deal/NN; ./.; here/RB; are/VBP; a/DT; few/JJ; examples/NNS; :/:; manufacturers/NNS; //VBP; distributors/NNS; are/VBP; not/RB; allowed/VBN; to/TO; export/VB; outside/IN; their/PRP$; territory/JJ; //JJ; country/NN; ./.; to/TO; avoid/VB; ``/``; disturbing/VBG; ``/``; the/DT; dealer/NN; //NNP; reseller/NN; channel/NN; in/IN; different/JJ; countries/NNS; ,/,; manufacturers/NNS; and/CC; distributors/NNS; can/MD; not/RB; export/VB; the/DT; product/NN; ,/,; as/IN; new/JJ; and/CC; therefore/RB; label/VBD; it/PRP; as/IN; refurb/NN; and/CC; reduce/VB; the/DT; warranty/NN; ./.; most/RBS; major/JJ; retail/JJ; superstores/NNS; offer/VBP; a/DT; 30/CD; -/:; day/NN; money/NN; back/RB; guarantee/NN; on/IN; their/PRP$; products/NNS; and/CC; there/EX; are/VBP; those/DT; consumers/NNS; that/WDT; just/RB; simply/RB; take/JJ; advantage/NN; of/IN; that/DT; ./.; these/DT; items/NNS; are/VBP; returned/VBN; to/TO; the/DT; manufacturer/NN; ,/,; inspected/VBN; and/CC; repackaged/VBN; like/IN; new/JJ; ./.; items/NNS; where/WRB; the/DT; box/NN; or/CC; casing/NN; was/VBD; damaged/VBN; in/IN; shipment/NN; ,/,; which/WDT; are/VBP; returned/VBN; to/TO; the/DT; manufacturer/NN; ./.; the/DT; item/NN; was/VBD; returned/VBN; to/TO; the/DT; manufacturer/NN; because/IN; of/IN; a/DT; slight/JJ; defect/NN; ./.; the/DT; part/NN; that/WDT; was/VBD; defective/JJ; was/VBD; replaced/VBN; by/IN; the/DT; manufacturer/NN; ,/,; tested/VBN; and/CC; then/RB; repackaged/VBD; just/RB; like/IN; new/JJ; ./.; the/DT; item/NN; was/VBD; returned/VBN; because/IN; of/IN; a/DT; minor/JJ; cosmetic/JJ; blemish/NN; on/IN; the/DT; casing/NN; that/WDT; was/VBD; corrected/VBN; ./.; demonstration/NN; units/NNS; are/VBP; also/RB; considered/VBN; factory/NN; refurbished/VBN; ./.; these/DT; units/NNS; are/VBP; inspected/VBN; ,/,; tested/VBN; and/CC; repackaged/VBN; ./.; the/DT; box/NN; was/VBD; simply/RB; opened/VBN; ./.; thats/NNS; it/PRP; !/.; brand/NN; new/JJ; overstocked/VBN; items/NNS; are/VBP; also/RB; labeled/JJ; factory/NN; refurbished/VBN; ./.; all/DT; factory/NN; refurbished/VBN; products/NNS; are/VBP; inspected/VBN; serviced/VBN; by/IN; the/DT; manufacturer/NN; then/RB; tested/VBD; and/CC; repackaged/VBD; to/TO; meet/VB; original/JJ; product/NN; specifications/NNS; ./.; all/DT; merchandise/NN; is/VBZ; warranted/VBN; by/IN; the/DT; original/JJ; manufacturer/NN; unless/IN; otherwise/RB; specified/VBN; ./.; ``/``; deals/NNS; of/IN; the/DT; week/NN; ``/``; toshiba/JJ; satellite/NN; model/NN; part/NN; no/DT; ./.; #/#; processor/NN; ram/NN; hdd/NN; drive/NN; screen/NN; o/JJ; //NNP; s/NN; nic/JJ; wireless/NN; condition/NN; prices/NNS; 2435/CD; -/:; s/NN; 255/CD; psa/NN; 243/CD; u/JJ; -/:; 0276/CD; rvb/NN; p/VBD; 4/CD; 2/CD; ./.; 4/CD; g/JJ; 512/CD; 40/CD; dvd/NN; //NNP; cdrw/VBZ; 15/CD; xga/NN; xph/VBD; 10/CD; //JJ; 100/CD; refurb/NN; //NN; 90/CD; days/NNS; $/$; 999/CD; ./.; 00/CD; a/DT; 75/CD; -/:; s/NN; 206/CD; psa/NN; 70/CD; u/JJ; -/:; 003002/CD; b/NN; p/NN; 4/CD; 2/CD; ./.; 8/CD; g/JJ; 512/CD; 60/CD; dvd/NN; //NNP; cdrw/VBZ; 15/CD; ./.; 4/CD; wxga/JJ; xph/$; 10/CD; //$; 100/CD; wifi/NN; refurb/NN; //$; 90/CD; days/NNS; $/$; 1135/CD; ./.; 00/CD; a/DT; 55/CD; -/:; s/NN; 3063/CD; centrinol/NN; ./.; 5/CD; g/JJ; 512/CD; 80/CD; dvd/NN; super/NN; multi/NN; 15/CD; xga/NNP; xph/VBD; 10/CD; //JJ; 100/CD; wifi/NN; refurb/NN; //$; 90/CD; days/NNS; $/$; 1185/CD; ./.; 00/CD; a/DT; 65/CD; -/:; sl/NN; 065/CD; p/NN; 4/CD; 2/CD; ./.; 8/CD; g/JJ; 512/CD; 60/CD; dvd/NN; //NNP; cdrw/VBZ; 15/CD; xga/NN; xpp/VBD; 10/CD; //JJ; 100/CD; refurb/NN; //NN; 90/CD; days/NNS; $/$; 1185/CD; ./.; 00/CD; a/DT; 65/CD; -/:; sl/NN; 762/CD; psa/NN; 60/CD; u/JJ; -/:; 019017/CD; p/NN; 4/CD; 3/CD; ./.; 2/CD; g/JJ; 512/CD; 60/CD; dvd/NN; rewriter/NN; 15/CD; xga/NNP; xph/VBD; 10/CD; //JJ; 100/CD; 802/CD; ./.; 11/CD; b/NN; //NNP; g/NN; )/); wifi/NN; refurb/NN; //$; 90/CD; days/NNS; $/$; 1210/CD; ./.; 00/CD; pl/NN; 5/CD; -/:; s/NN; 420/CD; pspl/NN; 0/CD; u/JJ; -/:; 3/CD; zj/NN; 97/CD; v/NN; p/NN; 4/CD; 3/CD; ./.; 0/CD; g/JJ; 512/CD; 80/CD; dvd/NN; rewriter/NN; 15/CD; ./.; 4/CD; wxga/JJ; xph/$; 10/CD; //$; 100/CD; wifi/NN; refurb/NN; //$; 90/CD; days/NNS; $/$; 1285/CD; ./.; 00/CD; pl/NN; 5/CD; -/:; s/NN; 479/CD; pspl/NN; 0/CD; u/JJ; -/:; 0/CD; dxpgrb/NN; p/NN; 4/CD; 2/CD; ./.; 8/CD; g/JJ; 512/CD; 60/CD; dvd/NN; rewriter/NN; 15/CD; ./.; 4/CD; wxga/JJ; xpmc/$; 10/CD; //$; 100/CD; wifi/NN; refurb/NN; //$; 90/CD; days/NNS; $/$; 1290/CD; ./.; 00/CD; p/NN; 25/CD; -/:; s/NN; 520/CD; psp/NN; 20/CD; u/JJ; -/:; 3/CD; f/JJ; 68/CD; zv/NN; p/NN; 4/CD; 3/CD; ./.; 0/CD; g/JJ; 512/CD; 80/CD; dvd/NN; ֲ±/NNP; rw/VBZ; 17/CD; xga/NN; xph/VBD; 10/CD; //JJ; 100/CD; wifi/NN; refurb/NN; //$; 90/CD; days/NNS; $/$; 1490/CD; ./.; 00/CD; p/NN; 25/CD; -/:; s/NN; 5263/CD; psp/NN; 20/CD; u/JJ; -/:; 4/CD; ej/NN; 7/CD; hvb/NN; p/NN; 4/CD; 3/CD; ./.; 0/CD; ht/VBD; 512/CD; 80/CD; dvd/NN; rewriter/NN; 17/CD; xga/NNP; xph/VBD; 10/CD; //JJ; 100/CD; wifi/NN; refurb/NN; //$; 90/CD; days/NNS; $/$; 1494/CD; ./.; 00/CD; m/NN; 35/CD; -/:; s/NN; 456/CD; psm/NN; 33/CD; u/JJ; -/:; 001001/CD; centrinol/NN; ./.; 7/CD; g/JJ; 512/CD; 80/CD; dvd/NN; super/NN; multi/NN; 15/CD; ./.; 4/CD; wxga/JJ; xph/$; 10/CD; //NNP; 100/CD; 802/CD; ./.; 11/CD; g/NN; )/); wifi/NN; refurb/NN; //$; 90/CD; days/NNS; $/$; 1585/CD; ./.; 00/CD; visit/NN; :/:; http/NN; :/:; //JJ; //NNP; www/NN; ./.; computron/NN; -/:; me/PRP; ./.; com/NN; for/IN; deals/NNS; !/.; your/PRP$; one/CD; stop/NN; distributorjebel/NN; ali/IN; duty/NN; free/JJ; zonedubai/NN; ,/,; uae/JJ; ./.; www/NN; ./.; computron/NN; -/:; me/PRP; ./.; com/VB; for/IN; latest/JJS; clearance/NN; sale/NN; listing/VBG; contact/JJ; our/PRP$; sales/NNS; department/NN; ./.; for/IN; further/JJ; details/NNS; please/VB; send/VB; your/PRP$; enquiries/NNS; to/TO; :/:; dealers/NNS; @/VBP; emirates/NNS; ./.; net/NN; ./.; aeor/JJ; contact/NN; via/IN; www/NN; ./.; computron/NN; -/:; me/PRP; ./.; com/VB; compaq/JJ; hewlett/NN; packard/NN; 3/CD; com/NN; dell/NN; intel/NN; iomega/JJ; epson/NN; aopen/JJ; creative/JJ; toshiba/NN; apc/NN; cisco/VBP; us/PRP; robotics/NNS; microsoft/JJ; canon/JJ; intellinet/NN; targus/NN; viewsonic/JJ; ibm/NN; sony/NN; -/:; -/:; -/:; -/:; -/:; -/:; -/:; and/CC; lots/NNS; more/JJR; !/.; !/.; !/.; if/IN; you/PRP; have/VBP; any/DT; complaints/NNS; //VBP; suggestions/NNS; contact/NN; :/:; customerservice/NN; @/NNP; computron/NN; -/:; me/PRP; ./.; com/VB; tel/NN; +/NNP; 971/CD; 4/CD; 8834464/CD; all/DT; prices/NNS; in/IN; u/JJ; ./.; s/NN; ./.; dollars/NNS; ,/,; ex/FW; -/:; works/NNS; ,/,; jebel/NN; ali/NNS; duty/VBP; free/JJ; zone/NN; fax/NN; +/VBD; 971/CD; 4/CD; 8834454/CD; www/NN; ./.; computron/NN; -/:; me/PRP; ./.; com/NN; prices/NNS; and/CC; availability/NN; subject/NN; to/TO; change/VB; without/IN; notice/NN; ./.; usa/JJ; -/:; canada/NN; u/NN; ./.; a/DT; ./.; e/NN; ./.; to/TO; receive/VB; our/PRP$; special/JJ; offers/NNS; in/IN; plain/NN; text/JJ; format/NN; reply/NN; to/TO; this/DT; mail/NN; with/IN; the/DT; request/NN; */NN; for/IN; export/NN; only/RB; */VBZ; this/DT; email/NN; can/MD; not/RB; be/VB; considered/VBN; spam/JJ; as/RB; long/RB; as/IN; we/PRP; include/VBP; :/:; contact/JJ; information/NN; remove/NN; instructions/NNS; ./.; this/DT; message/NN; is/VBZ; intended/VBN; for/IN; dealer/NN; and/CC; resellers/NNS; only/RB; ./.; if/IN; you/PRP; have/VBP; somehow/VBN; gotten/VBN; on/IN; this/DT; list/NN; in/IN; error/NN; ,/,; or/CC; for/IN; any/DT; other/JJ; reason/NN; would/MD; like/VB; to/TO; be/VB; removed/VBN; ,/,; please/VB; reply/VB; with/IN; ``/``; remove/VB; ``/``; in/IN; the/DT; subject/JJ; line/NN; of/IN; your/PRP$; message/NN; ./.; this/DT; message/NN; is/VBZ; being/VBG; sent/VBN; to/TO; you/PRP; in/IN; compliance/NN; with/IN; the/DT; federal/JJ; legislation/NN; for/IN; commercial/JJ; e/NN; -/:; mail/NN; (/(; h/NN; ./.; r/NN; ./.; 4176/CD; -/:; section/NN; 101/CD; paragraph/NN; (/(; e/NN; )/); (/(; 1/CD; )/); (/(; a/DT; )/); and/CC; bill/NN; s/NN; ./.; 1618/CD; title/NN; iii/NN; passed/VBN; by/IN; the/DT; 105/CD; th/NN; u/NN; ./.; s/NN; ./.; congress/NN; ./.; all/DT; logos/NN; and/CC; trademarks/NNS; are/VBP; the/DT; property/NN; of/IN; their/PRP$; respective/JJ; owners/NNS; products/NNS; may/MD; not/RB; be/VB; exactly/RB; as/IN; shown/VBN; above/IN; -/:; -/:; to/TO; unsubscribe/VB; from/IN; :/:; computron/NN; 4/CD; ,/,; just/RB; follow/VB; this/DT; link/NN; :/:; click/VB; the/DT; link/NN; ,/,; or/CC; copy/NN; and/CC; paste/NN; the/DT; address/NN; into/IN; your/PRP$; browser/NN; ./.; please/VB; give/VB; it/PRP; atleast/RB; 48/CD; hours/NNS; for/IN; unsubscription/NN; to/TO; be/VB; effective/JJ; ./.",N/A,0.9942,75.0,6,10,1,10,0,0,0,5,6,2,2,17,38,76,31,10,0,0,0,0,1,2,0,0,0,0,0,0,0,0,0,0,Unknown
0,0,0,0,0,0,N/A,,0,False,0,N/A,False,0,,N/A,0.0,206.84,0,0,0,0,0,0,0,0,0,0,0,0,0,0,0,0,0,0,0,0,0,0,0,0,0,0,0,0,0,0,0,0,Unknown
146,0,0,4,35.5,3,N/A,message is: 2; re :: 1; : painfull: 1; painfull appointment: 1; appointment wednesday: 1,10,True,56,N/A,False,0.726027397260274,"re/NN; :/:; painfull/NN; appointment/NN; wednesday/NN; at/IN; 14/CD; -/:; 00/CD; hi/NN; there/RB; bro/VBZ; -/:; feel/VB; the/DT; rush/NN; v/NN; _/VBD; 1/CD; ,/,; c/SYM; -/:; o/NN; '/''; d/JJ; -/:; 1/CD; '/POS; n/JJ; 75/CD; o/JJ; m/NN; _/NNP; gg/VBZ; 3/CD; o/NN; p/NN; !/.; lls/VBZ; 169/CD; ./.; oo/VB; more/JJR; pain/NN; relief/NN; here/RB; same/JJ; day/NN; shlpp/VBD; 1/CD; ng/NN; to/TO; stop/VB; your/PRP$; bankofamerica/NN; account/NN; frankie/JJ; benton/NN; fuster/NN; valoit/NN; ,/,; inc/NN; ./.; ,/,; piscataway/RB; ,/,; nj/RB; 08854/CD; ,/,; united/JJ; states/NNS; of/IN; america/JJ; phone/NN; :/:; 157/CD; -/:; 142/CD; -/:; 2911/CD; mobile/NN; :/:; 176/CD; -/:; 954/CD; -/:; 9844/CD; email/NN; :/:; tfjyjxu/NN; @/NN; axn/SYM; -/:; asia/NN; ./.; com/VB; your/PRP$; reply/NN; to/TO; this/DT; confirmation/NN; message/NN; is/VBZ; not/RB; needed/VBN; this/DT; freeware/NN; is/VBZ; a/DT; 64/CD; hour/NN; trial/NN; freeware/NN; notes/NNS; :/:; the/DT; contents/NNS; of/IN; this/DT; message/NN; is/VBZ; for/IN; attention/NN; and/CC; should/MD; not/RB; be/VB; spark/RB; various/JJ; fairchild/JJ; emblazon/NN; asymptote/JJ; time/NN; :/:; sat/NN; ,/,; 22/CD; jan/NN; 2005/CD; 02/CD; :/:; 07/CD; :/:; 48/CD; -/:; 0800/CD",N/A,0.6074,67.62,1,0,0,0,0,0,2,0,0,0,0,6,10,3,0,8,0,0,0,0,0,1,0,0,0,0,2,0,0,0,0,0,Unknown
137,0,0,11,11.454545454545455,8,N/A,- $: 5; . 95: 5; 95 -: 4; localized software: 2; mx 2004: 2,11,False,40,N/A,False,0.6423357664233577,"localized/VBN; software/NN; ,/,; all/DT; languages/NNS; available/JJ; ./.; hello/NN; ,/,; we/PRP; would/MD; like/VB; to/TO; offer/VB; localized/JJ; software/NN; versions/NNS; (/(; german/JJ; ,/,; french/JJ; ,/,; spanish/JJ; ,/,; uk/JJ; ,/,; and/CC; many/JJ; others/NNS; )/); ./.; aii/NN; listed/VBN; software/NN; is/VBZ; available/JJ; for/IN; immediate/JJ; download/NN; !/.; no/DT; need/NN; to/TO; wait/VB; 2/CD; -/:; 3/CD; week/NN; for/IN; cd/NN; deiivery/NN; !/.; just/RB; few/JJ; examples/NNS; :/:; -/:; norton/NN; internet/NN; security/NN; pro/JJ; 2005/CD; -/:; $/$; 29/CD; ./.; 95/CD; -/:; windows/NNS; xp/VBP; professionai/NN; with/IN; sp/JJ; 2/CD; full/JJ; version/NN; -/:; $/$; 59/CD; ./.; 95/CD; -/:; corei/NN; draw/NN; graphics/NNS; suite/VBP; 12/CD; -/:; $/$; 49/CD; ./.; 95/CD; -/:; dreamweaver/NN; mx/NN; 2004/CD; (/(; homesite/JJ; 5/CD; ./.; 5/CD; inciudinq/NN; )/); -/:; $/$; 39/CD; ./.; 95/CD; -/:; macromedia/NN; studio/NN; mx/NN; 2004/CD; -/:; $/$; 119/CD; ./.; 95/CD; just/RB; browse/VB; our/PRP$; site/NN; and/CC; find/VB; any/DT; software/NN; you/PRP; need/VBP; in/IN; your/PRP$; native/JJ; ianquaqe/NN; !/.; best/JJS; reqards/NNS; ,/,; keila/NN",N/A,0.8854,71.61,3,0,0,5,0,0,0,2,2,0,0,7,11,8,0,1,0,0,0,0,0,0,0,0,0,0,0,0,0,0,0,0,Unknown
1,0,0,0,0,0,N/A,,0,False,0,N/A,False,1.0,empty/JJ,N/A,-0.2023,36.62,0,0,0,0,0,0,0,0,0,0,0,0,0,0,0,0,0,0,0,0,0,0,0,0,0,0,0,0,0,0,0,0,Unknown
24,0,0,4,5.0,4,N/A,". .: 2; replica handbags: 1; handbags ,: 1; , genuine: 1; genuine repiica: 1",1,False,2,N/A,False,0.875,"replica/NN; handbags/NNS; ,/,; genuine/JJ; repiica/NN; watches/NNS; -/:; over/IN; 20/CD; brands/NNS; including/VBG; rolex/JJ; omega/JJ; iwc/NN; ./.; ./.; ./.; more/RBR; detalls/NNS; here/RB; r/VBP; ./.; emove/VB; me/PRP",N/A,0.0,79.26,0,0,0,0,0,0,0,0,0,0,0,1,1,4,0,0,0,0,0,0,0,0,0,0,0,0,0,0,0,0,0,0,Unknown
492,0,0,19,26.105263157894736,17,N/A,of the: 8; to be: 4; the late: 4; your assistance: 3; my father: 3,2,True,10,N/A,False,0.5345528455284553,"DEAR/NNP; SIR/MADAMRE/NNP; :/:; BUSINESS/NNP; ASSISTANCEI/NNP; have/VBP; decided/VBN; to/TO; contact/VB; your/PRP$; assistance/NN; in/IN; relation/NN; to/TO; the/DT; following/VBG; business/NN; proposal/NN; ,/,; having/VBG; obtained/VBN; your/PRP$; contact/NN; through/IN; the/DT; commercial/JJ; attach/NN; of/IN; your/PRP$; country/NN; 's/POS; embassy/NN; in/IN; South/NNP; Africa/NNP; ./.; This/DT; recommendation/NN; is/VBZ; based/VBN; on/IN; the/DT; information/NN; that/IN; you/PRP; will/MD; not/RB; betray/VB; the/DT; trust/NN; and/CC; confidence/NN; to/TO; be/VB; reposed/VBN; in/IN; you/PRP; ./.; I/PRP; am/VBP; Romila/NNP; Kabila/NNP; the/DT; second/JJ; son/NN; of/IN; the/DT; assassinated/JJ; former/JJ; President/NNP; Of/IN; Democratic/NNP; Republic/NNP; Of/IN; Congo/NNP; (/(; D.C/NNP; )/); Late/NNP; Laurent/NNP; Desire/NNP; Kabila/NNP; who/WP; on/IN; Tuesday/NNP; 16/CD; January/NNP; during/IN; the/DT; four/CD; years/NNS; rule/NN; of/IN; my/PRP$; father/NN; I/PRP; was/VBD; his/PRP$; confidential/private/JJ; security/NN; and/CC; base/NN; on/IN; my/PRP$; position/NN; of/IN; relationship/NN; of/IN; father/NN; and/CC; son/NN; ./.; I/PRP; was/VBD; able/JJ; to/TO; be/VB; in/IN; change/NN; of/IN; the/DT; president/NN; 's/POS; personal/JJ; security/NN; vault/NN; and/CC; some/DT; of/IN; his/PRP$; savings.Now/NN; following/VBG; the/DT; death/NN; of/IN; my/PRP$; father/NN; ,/,; the/DT; immediate/JJ; family/NN; of/IN; the/DT; late/JJ; President/NNP; Kabila/NNP; has/VBZ; met/VBN; and/CC; concluded/VBD; that/IN; some/DT; savings/NNS; and/CC; security/NN; vault/NN; of/IN; the/DT; former/JJ; President/NNP; should/MD; be/VB; moved/VBN; out/IN; of/IN; the/DT; troubled/JJ; Democratic/NNP; Republic/NNP; of/IN; Congo/NNP; with/IN; immediate/JJ; president/NN; of/IN; Democratic/NNP; republic/NN; of/IN; Congo/NNP; by/IN; the/DT; late/JJ; Kabila/NNP; has/VBZ; been/VBN; appointed/VBN; president/NN; of/IN; democratic/JJ; republic/NN; of/IN; Congo/NNP; by/IN; the/DT; late/JJ; kabila/NN; 's/POS; national/JJ; executive/NN; council/NN; and/CC; the/DT; country/NN; top/JJ; military/JJ; brass/NN; ,/,; and/CC; properties/NNS; worth/JJ; millions/NNS; of/IN; US/NNP; $/$; to/TO; relocate/VB; the/DT; late/JJ; president/NN; kabila/NN; 's/POS; assets/NNS; and/CC; properties/NNS; with/IN; millions/NNS; of/IN; dollars/NNS; to/TO; over/IN; sea/NN; country/NN; where/WRB; there/EX; is/VBZ; good/JJ; political/JJ; climate/NN; ./.; We/PRP; have/VBP; concluded/VBN; arrangement/NN; to/TO; move/transfer/VB; the/DT; sum/NN; US/NNP; $/$; 42M/CD; to/TO; a/DT; finance/NN; and/CC; security/NN; company/NN; in/IN; London/NNP; through/IN; a/DT; Diplomatic/NNP; courier/NN; services/NNS; ./.; The/DT; family/NN; through/IN; a/DT; diplomatic/JJ; contact/NN; during/IN; my/PRP$; father/NN; 's/POS; regime/NN; ,/,; conclude/VBP; an/DT; arrangement/NN; to/TO; lodge/deposit/VB; the/DT; above/JJ; sums/NNS; with/IN; the/DT; GLOBAL/NNP; DIPLOMATIC/NNP; AND/NNP; SECURITY/NNP; SERVICES/NNP; in/IN; LONDON/NNP; -/:; U.K/NN; !/.; ./.; And/CC; it/PRP; is/VBZ; on/IN; this/DT; ,/,; that/IN; I/PRP; am/VBP; soliciting/VBG; for/IN; your/PRP$; assistance/NN; to/TO; help/VB; us/PRP; receive/VB; this/DT; amount/NN; from/IN; this/DT; security/NN; company/NN; once/IN; it/PRP; arrives/VBZ; London/NNP; upon/IN; your/PRP$; acceptance/NN; to/TO; assist/VB; in/IN; this/DT; project/NN; as/IN; we/PRP; the/DT; family/NN; member/NN; can/MD; not/RB; do/VB; it/PRP; on/IN; our/PRP$; own/JJ; because/IN; of/IN; the/DT; code/NN; of/IN; conduct/NN; ,/,; which/WDT; was/VBD; introduced/VBN; by/IN; my/PRP$; late/JJ; father/NN; to/TO; checkmate/VB; excess/JJ; embezzlement/siphoning/NN; of/IN; the/DT; Government/public/NNP; funds/NNS; overseas/RB; country/NN; as/IN; the/DT; case/NN; had/VBD; be/VB; during/IN; the/DT; Late/NNP; President/NNP; Mobutu/NNP; Sese/NNP; Seko/NNP; ./.; So/IN; one/CD; can/MD; not/RB; make/VB; law/NN; and/CC; destroy/VB; the/DT; same/JJ; law/NN; ./.; Therefore/RB; if/IN; you/PRP; can/MD; render/VB; your/PRP$; assistance/NN; ,/,; please/VB; indicate/VB; your/PRP$; interest/NN; to/TO; me/PRP; through/IN; my/PRP$; email/NN; romkabila/NN; @/NNP; presidency.com/NN; ,/,; you/PRP; should/MD; then/RB; urgently/RB; arrange/VBP; to/TO; travel/VB; to/TO; London/NNP; and/CC; clear/VB; the/DT; (/(; consignments/NNS; )/); funds/NNS; upon/IN; it/PRP; arrival/JJ; and/CC; subsequent/JJ; payment/NN; of/IN; the/DT; US/NNP; $/$; 42M/CD; into/IN; your/PRP$; bank/NN; account/NN; ./.; As/RB; soon/RB; as/IN; we/PRP; hear/VBP; from/IN; you/PRP; ,/,; we/PRP; then/RB; send/VB; a/DT; representative/NN; to/TO; be/VB; with/IN; you/PRP; in/IN; London/NNP; to/TO; represent/VB; our/PRP$; interest/NN; ./.; Based/VBN; on/IN; your/PRP$; anticipated/JJ; efforts/NNS; and/CC; contri/NN; !/.; bution/NN; the/DT; family/NN; has/VBZ; resolved/VBN; to/TO; give/VB; you/PRP; 20/CD; %/NN; commission/NN; and/CC; the/DT; remaining/VBG; 80/CD; %/NN; will/MD; be/VB; reclaimed/VBN; by/IN; the/DT; family/NN; ./.; It/PRP; will/MD; be/VB; my/PRP$; pleasure/NN; to/TO; be/VB; able/JJ; to/TO; co-operate/VB; with/IN; you/PRP; on/IN; terms/NNS; that/IN; you/PRP; may/MD; wish/VB; for/IN; the/DT; successful/JJ; completion/NN; of/IN; this/DT; project/NN; ./.; Thanks/NNS; and/CC; remain/VBP; blessed.Best/JJ; Regards/NNP; ,/,; ROMILA/NNP; KABILA/NNP",N/A,0.9936,43.87,2,0,0,3,2,0,5,2,2,0,0,10,2,17,6,1,0,0,0,0,0,1,0,0,0,0,0,0,0,0,0,0,Unknown
