Word Count,URL Count,Email Count,Sentence Count,Average Sentence Length,NumDots,UrlLength,Most Common Bigrams,NumDash,AtSymbol,NumNumericChars,RandomString,IpAddress,Lexical Diversity,POS Tags,Named Entities,Sentiment Score,Readability Score,!,"""",#,$,%,&,',(,),*,+,",",-,.,/,:,;,<,=,>,?,@,[,\,],^,_,`,{,|,},~
479,0,0,46,11.152173913043478,36,N/A,"* *: 122; -- --: 27; , and: 5; to lose: 4; you ,: 4",73,True,31,N/A,False,0.6116910229645094,"Long/JJ; time/NN; no/DT; chat/NN; !/.; How/WRB; have/VBP; you/PRP; been/VBN; ?/.; If/IN; you/PRP; 've/VBP; been/VBN; like/IN; me/PRP; ,/,; you/PRP; 've/VBP; been/VBN; trying/VBG; trying/VBG; almost/RB; EVERYTHING/NN; to/TO; lose/VB; weight.ֳ‚ֲ/NN; I/PRP; know/VBP; how/WRB; you/PRP; feel/VBP; -/:; the/DT; special/JJ; diets/NNS; ,/,; miracle/NN; pills/NNS; ,/,; and/CC; fancy/JJ; exercise/NN; equipment/NN; never/RB; helped/VBD; me/PRP; lose/VB; the/DT; pounds/NNS; I/PRP; needed/VBD; to/TO; lose/VB; either.ֳ‚ֲ/NN; It/PRP; seemed/VBD; like/IN; the/DT; harder/NN; I/PRP; worked/VBD; at/IN; it/PRP; ,/,; the/DT; less/JJR; weight/JJ; I/PRP; lost/VBD; -/:; until/IN; I/PRP; heard/VBP; about/IN; 'Extreme/JJ; Power/NNP; Plus'.You/NNP; 're/VBP; probably/RB; thinking/VBG; to/TO; yourself/VB; ,/,; ``/``; Oh/UH; geez/NN; ,/,; not/RB; another/DT; miracle/NN; diet/NN; pill/NN; !/.; ``/``; ֳ‚ֲ/VBP; Like/IN; you/PRP; ,/,; I/PRP; was/VBD; skeptical/JJ; at/IN; first/JJ; ,/,; but/CC; my/PRP$; sister/NN; said/VBD; it/PRP; helped/VBD; her/PRP; lose/VB; 23/CD; pounds/NNS; in/IN; just/RB; 2/CD; weeks/NNS; ,/,; so/IN; I/PRP; told/VBD; her/PRP; I/PRP; 'd/MD; give/VB; it/PRP; a/DT; try.ֳ‚ֲ/NN; I/PRP; mean/VBP; ,/,; there/EX; was/VBD; nothing/NN; to/TO; lose/VB; except/IN; a/DT; lot/NN; of/IN; weight/NN; !/.; ֳ‚ֲ/JJ; Let/VB; me/PRP; tell/VB; you/PRP; ,/,; it/PRP; was/VBD; the/DT; best/JJS; decision/NN; I/PRP; 've/VBP; ever/RB; made/VBN; ./.; PERIOD/NNP; ./.; Six/NNP; months/NNS; later/RB; ,/,; as/IN; I/PRP; 'm/VBP; writing/VBG; this/DT; message/NN; to/TO; you/PRP; ,/,; I/PRP; 've/VBP; gone/VBN; from/IN; 355/CD; pounds/NNS; to/TO; 210/CD; pounds/NNS; ,/,; and/CC; I/PRP; have/VBP; n't/RB; changed/VBN; my/PRP$; exercise/NN; routine/NN; or/CC; diet/NN; at/IN; all.ֳ‚ֲ/JJ; Yes/NNP; ,/,; I/PRP; still/RB; eat/VBP; pizza/NN; ,/,; and/CC; lots/NNS; of/IN; it/PRP; !/.; I/PRP; was/VBD; so/RB; happy/JJ; with/IN; the/DT; results/NNS; that/IN; I/PRP; contacted/VBD; the/DT; manufacturer/NN; and/CC; received/VBN; permission/NN; to/TO; resell/VB; it/PRP; -/:; at/IN; a/DT; HUGE/NNP; discount.ֳ‚ֲ/NN; I/PRP; feel/VBP; the/DT; need/NN; to/TO; help/VB; other/JJ; people/NNS; lose/VBP; weight/IN; like/IN; I/PRP; did/VBD; ,/,; because/IN; it/PRP; does/VBZ; so/RB; much/JJ; for/IN; your/PRP$; self-esteem/NN; ,/,; not/RB; to/TO; mention/VB; your/PRP$; health/NN; ./.; I/PRP; am/VBP; giving/VBG; you/PRP; my/PRP$; personal/JJ; pledge/NN; that/WDT; 'Extreme/VBZ; Power/NNP; Plus'/NNP; absolutely/RB; WILL/NNP; WORK/NNP; FOR/NNP; YOU/NNP; ./.; 100/CD; %/NN; Money-Back/NNP; GUARANTEED/NNP; !/.; If/IN; you/PRP; are/VBP; frustrated/VBN; with/IN; trying/VBG; other/JJ; products/NNS; ,/,; without/IN; having/VBG; any/DT; success/NN; ,/,; and/CC; just/RB; not/RB; getting/VBG; the/DT; results/NNS; you/PRP; were/VBD; promised/VBN; ,/,; then/RB; I/PRP; recommend/VBP; the/DT; only/JJ; product/NN; that/WDT; worked/VBD; for/IN; me/PRP; -/:; 'EXTREME/''; POWER/NNP; PLUS/NNP; '/POS; !/.; You/PRP; 're/VBP; probably/RB; asking/VBG; yourself/PRP; ,/,; ``/``; Ok/UH; ,/,; so/IN; how/WRB; does/VBZ; this/DT; stuff/NN; actually/RB; work/VB; ?/.; ``/``; Extreme/JJ; Power/NNP; Plus/NNP; contains/VBZ; Lipotropic/NNP; fat/NN; burners/NNS; and/CC; ephedra/NN; which/WDT; is/VBZ; scientifically/RB; proven/VBN; to/TO; increase/VB; metabolism/NN; and/CC; cause/NN; rapid/JJ; weight/JJ; loss/NN; ./.; No/UH; ``/``; hocus/VB; pocus/NN; ''/''; in/IN; these/DT; pills/NNS; -/:; just/RB; RESULTS/VB; !/.; !/.; !/.; Here/RB; is/VBZ; the/DT; bottom/JJ; line/NN; .../:; I/PRP; can/MD; help/VB; you/PRP; lose/VB; 10-15/JJ; pounds/NNS; per/IN; week/NN; naturally/RB; ,/,; without/IN; exercising/VBG; and/CC; without/IN; having/VBG; to/TO; eat/VB; rice/NN; cakes/NNS; all/DT; day.ֳ‚ֲ/NN; Just/NNP; try/VB; it/PRP; for/IN; one/CD; month/NN; -/:; there/EX; 's/VBZ; pounds/NNS; to/TO; lose/VB; and/CC; confidence/NN; to/TO; gain/VB; !/.; ֳ‚ֲ/NN; You/PRP; will/MD; lose/VB; weight/NN; fast/SYM; -/:; GUARANTEED.ֳ‚ֲ/NN; This/DT; is/VBZ; my/PRP$; pledge/NN; to/TO; you.BONUS/VB; !/.; Order/NNP; NOW/NNP; &/CC; get/VB; FREE/JJ; SHIPPING/NN; on/IN; 3/CD; bottles/NNS; or/CC; more/JJR; !/.; ֳ‚ֲ/NN; To/TO; order/NN; Extreme/NNP; Power/NNP; Plus/NNP; on/IN; our/PRP$; secure/NN; server/NN; ,/,; just/RB; click/NN; on/IN; this/DT; link/NN; -/:; >/JJ; http/NN; :/:; //www.2002dietspecials.com/To/NN; see/VBP; what/WP; some/DT; of/IN; our/PRP$; customers/NNS; have/VBP; said/VBD; about/IN; this/DT; product/NN; ,/,; visit/NN; http/NN; :/:; //www.2002dietspecials.com/testimonials.shtmlTo/NN; see/VBP; a/DT; list/NN; of/IN; ingredients/NNS; and/CC; for/IN; more/JJR; information/NN; on/IN; test/NN; studies/NNS; and/CC; how/WRB; it/PRP; will/MD; help/VB; you/PRP; lose/VB; weight/NN; ,/,; visit/NN; http/NN; :/:; //www.2002dietspecials.com/ingre1.shtml/JJ; */NNP; */NNP; */NNP; */NNP; */NNP; */NNP; */NNP; */NNP; */NNP; */NNP; */NNP; */NNP; */NNP; */NNP; */NNP; */NNP; */NNP; */NNP; */NNP; */NNP; */NNP; */NNP; */NNP; */NNP; */NNP; */NNP; */NNP; */NNP; */NNP; */NNP; */NNP; */NNP; */NNP; */NNP; */NNP; */NNP; */NNP; */NNP; */NNP; */NNP; */NNP; */NNP; */NNP; */NNP; */NNP; */NNP; */NNP; */NNP; */NNP; */NNP; */NNP; */NNP; */NNP; */NNP; */NNP; */NNP; */NNP; */NNP; */NNP; */NNP; */NNP; */NNP; If/IN; you/PRP; feel/VBP; that/IN; you/PRP; have/VBP; received/VBN; this/DT; email/NN; in/IN; error/NN; ,/,; please/VB; send/VB; an/DT; email/NN; to/TO; ``/``; print2/VB; @/JJ; btamail.net.cn/NN; ''/''; requesting/VBG; to/TO; be/VB; removed/VBN; ./.; Thank/NNP; you/PRP; ,/,; and/CC; we/PRP; apologize/VBP; for/IN; any/DT; inconvenience/NN; ./.; */CC; */JJ; */NNP; */NNP; */NNP; */NNP; */NNP; */NNP; */NNP; */NNP; */NNP; */NNP; */NNP; */NNP; */NNP; */NNP; */NNP; */NNP; */NNP; */NNP; */NNP; */NNP; */NNP; */NNP; */NNP; */NNP; */NNP; */NNP; */NNP; */NNP; */NNP; */NNP; */NNP; */NNP; */NNP; */NNP; */NNP; */NNP; */NNP; */NNP; */NNP; */NNP; */NNP; */NNP; */NNP; */NNP; */NNP; */NNP; */NNP; */NNP; */NNP; */NNP; */NNP; */NNP; */NNP; */NNP; */NNP; */NNP; */NNP; */NNP; */NNP; */NNP; --/:; DeathToSpamDeathToSpamDeathToSpam/NNP; --/:; --/:; --/:; --/:; --/:; --/:; --/:; --/:; --/:; --/:; --/:; --/:; --/:; --/:; --/:; --/:; --/:; --/:; --/:; --/:; --/:; --/:; --/:; --/:; --/:; --/:; --/:; --/:; -/:; This/DT; sf.net/NN; email/NN; is/VBZ; sponsored/VBN; by/IN; :/:; ThinkGeek/JJ; Welcome/NNP; to/TO; geek/VB; heaven/RB; ./.; http/NN; :/:; //thinkgeek.com/sf/JJ; _______________________________________________/JJ; Spamassassin-Sightings/NNS; mailing/VBG; list/NN; Spamassassin-Sightings/NNP; @/NNP; lists.sourceforge.net/NN; https/NN; :/:; //lists.sourceforge.net/lists/listinfo/spamassassin-sightings/NNS",N/A,0.9905,65.93,12,8,0,0,1,1,16,0,0,124,0,29,73,36,17,6,0,0,0,1,2,2,0,0,0,0,47,0,0,0,0,0,Unknown
130,0,0,11,10.818181818181818,11,N/A,plurabelle .: 3; . co: 3; co .: 3; . uk: 3; plurabelle books: 2,3,True,27,N/A,False,0.6307692307692307,"junk/NN; mail/NN; :/:; books/NNS; for/IN; linguists/NNS; plurabelle/VBP; books/NNS; has/VBZ; a/DT; new/JJ; catalogue/NN; of/IN; second/JJ; hand/NN; and/CC; out/IN; of/IN; print/NN; books/NNS; in/IN; linguistics/NNS; and/CC; history/NN; of/IN; linguistics/NNS; available/JJ; ./.; it/PRP; contains/VBZ; 250/CD; titles/NNS; ./.; please/VB; ask/VB; for/IN; your/PRP$; free/JJ; copy/NN; of/IN; the/DT; catalogue/NN; (/(; please/VB; include/VB; your/PRP$; mailing/VBG; address/NN; if/IN; you/PRP; want/VBP; a/DT; paper/NN; copy/NN; )/); or/CC; visit/VB; us/PRP; on/IN; the/DT; net/JJ; http/NN; :/:; //JJ; //NNP; www/NN; ./.; plurabelle/NN; ./.; co/NN; ./.; uk/JJ; //JJ; lingu/NN; ./.; htm/NN; or/CC; write/VB; to/TO; dr/VB; michael/JJ; cahn/NN; plurabelle/NN; books/NNS; 77/CD; garden/NN; walk/NN; cambridge/NN; cb4/VBD; 3ew/CD; tel/NN; 0044/CD; -/:; 1223/CD; -/:; 366680/CD; ,/,; fax/SYM; -/:; 571105/CD; lingu/NN; @/NNP; plurabelle/NN; ./.; co/NN; ./.; uk/NN; we/PRP; only/RB; sell/VBP; books/NNS; we/PRP; would/MD; like/VB; to/TO; read/VB; open/JJ; anytime/NN; at/IN; http/NN; :/:; //JJ; //NNP; www/NN; ./.; plurabelle/NN; ./.; co/NN; ./.; uk/NN",N/A,0.9169,75.74,0,0,0,0,0,0,0,1,1,0,0,1,3,11,5,3,0,0,0,0,0,1,0,0,0,0,0,0,0,0,0,0,Unknown
64,0,0,2,31.0,2,N/A,you have: 1; have to: 1; to be: 1; be kidding: 1; kidding me: 1,0,False,24,N/A,False,0.875,"you/PRP; have/VBP; to/TO; be/VB; kidding/VBG; me/PRP; ./.; this/DT; is/VBZ; a/DT; special/JJ; advertisement/NN; ./.; 437/CD; e/NN; 1000/CD; s/NN; pleasant/JJ; grove/NN; ,/,; ut/JJ; 84062/CD; to/TO; unsubscribe/VB; and/CC; not/RB; receive/VB; any/DT; future/JJ; mailings/NNS; for/IN; any/DT; of/IN; our/PRP$; offers/NNS; please/VB; click/NN; here/RB; the/DT; link/NN; below/IN; :/:; please/NN; refer/VB; all/DT; questions/NNS; ,/,; opinions/NNS; or/CC; additional/JJ; feedback/NN; to/TO; :/:; service/NN; dept/IN; 9420/CD; reseda/NN; blvd/NN; #/#; 133/CD; northridge/NN; ,/,; ca/MD; 91324/CD",N/A,0.875,69.41,0,0,1,0,0,0,0,0,0,0,0,3,0,2,0,2,0,0,0,0,0,0,0,0,0,0,0,0,0,0,0,0,Unknown
204,0,0,10,19.4,7,N/A,_ _: 100; your company: 2; . we: 2; you !: 2; of your: 2,0,False,0,N/A,False,0.3627450980392157,"a/DT; chance/NN; to/TO; get/VB; new/JJ; logo/NN; now/RB; working/VBG; on/IN; your/PRP$; company/NN; '/POS; s/NN; image/NN; ?/.; start/VB; with/IN; a/DT; visual/JJ; identity/NN; a/DT; key/NN; to/TO; the/DT; first/JJ; good/JJ; impression/NN; ./.; we/PRP; are/VBP; here/RB; to/TO; help/VB; you/PRP; !/.; we/PRP; '/''; ll/NNS; take/VBP; part/NN; in/IN; buildinq/NN; a/DT; positive/JJ; visual/JJ; imaqe/NN; of/IN; your/PRP$; company/NN; by/IN; creatinq/VBG; an/DT; outstandinq/NN; logo/NN; ,/,; presentable/JJ; stationery/NN; items/NNS; and/CC; professionai/JJ; website/NN; ./.; these/DT; marketinq/NN; tools/NNS; wiil/VBP; significantiy/JJ; contributeto/NN; success/NN; of/IN; your/PRP$; business/NN; ./.; take/VB; a/DT; iook/NN; at/IN; our/PRP$; work/NN; sampies/NNS; ,/,; hot/JJ; deai/NN; packaqes/NN; and/CC; see/VB; what/WP; we/PRP; have/VBP; to/TO; offer/VB; ./.; we/PRP; work/VBP; for/IN; you/PRP; !/.; _/VB; _/JJ; _/NNP; _/NNP; _/NNP; _/NNP; _/NNP; _/NNP; _/NNP; _/NNP; _/NNP; _/NNP; _/NNP; _/NNP; _/NNP; _/NNP; _/NNP; _/NNP; _/NNP; _/NNP; _/NNP; _/NNP; _/NNP; _/NNP; _/NNP; _/NNP; _/NNP; _/NNP; _/NNP; _/NNP; _/NNP; _/NNP; _/NNP; _/NNP; _/NNP; _/NNP; _/NNP; _/NNP; _/NNP; _/NNP; _/NNP; _/NNP; _/NNP; _/NNP; _/NNP; _/NNP; _/NNP; _/NNP; _/NNP; _/NNP; _/NNP; not/RB; interested/JJ; ./.; ./.; ./.; _/JJ; _/JJ; _/NN; _/NNP; _/NNP; _/NNP; _/NNP; _/NNP; _/NNP; _/NNP; _/NNP; _/NNP; _/NNP; _/NNP; _/NNP; _/NNP; _/NNP; _/NNP; _/NNP; _/NNP; _/NNP; _/NNP; _/NNP; _/NNP; _/NNP; _/NNP; _/NNP; _/NNP; _/NNP; _/NNP; _/NNP; _/NNP; _/NNP; _/NNP; _/NNP; _/NNP; _/NNP; _/NNP; _/NNP; _/NNP; _/NNP; _/NNP; _/NNP; _/NNP; _/NNP; _/NNP; _/NNP; _/NNP; _/NNP; _/NNP; _/NN",N/A,0.934,83.9,2,0,0,0,0,0,2,0,0,0,0,2,0,7,0,0,0,0,0,0,1,0,0,0,0,0,102,0,0,0,0,0,Unknown
406,0,0,11,35.90909090909091,10,N/A,- -: 10; . info: 3; info /: 3; ' the: 2; the antidote: 2,13,False,0,N/A,False,0.874384236453202,"miracle/NN; protein/NN; for/IN; immune/JJ; system/NN; '/''; the/DT; antidote/NN; '/POS; kills/NNS; all/DT; known/VBN; deadly/RB; viruses/VBZ; bacteria/NNS; in/IN; the/DT; body/NN; that/WDT; keep/VBP; diseases/NNS; ,/,; namely/RB; :/:; influenza/NN; ,/,; sars/NNS; ,/,; cancer/NN; ,/,; hiv/JJ; etc/NN; ./.; a/DT; disease/NN; must/MD; be/VB; made/VBN; dormant/JJ; to/TO; stop/VB; infection/NN; ./.; '/''; the/DT; antidote/NN; '/''; is/VBZ; the/DT; answer/NN; ./.; www/NN; ./.; alwond/NN; ./.; info/JJ; //JJ; hp/NN; //IN; we/PRP; are/VBP; the/DT; only/JJ; company/NN; in/IN; the/DT; world/NN; who/WP; have/VBP; developed/VBN; and/CC; enhanced/VBN; this/DT; product/NN; for/IN; sale/NN; ./.; check/VB; here/RB; for/IN; more/JJR; information/NN; www/NN; ./.; alwond/NN; ./.; info/JJ; //JJ; hp/NN; //NNP; not/RB; interested/JJ; ?/.; http/NN; :/:; //NN; //NNP; get/VB; -/:; it/PRP; -/:; online/NN; ./.; info/JJ; //JJ; soft/JJ; //NNP; chair/NN; ./.; php/CC; -/:; -/:; -/:; -/:; -/:; -/:; -/:; -/:; -/:; -/:; -/:; blemish/JJ; administer/NN; gerhard/NN; wheatstone/NN; secretive/JJ; colorate/NN; featherweight/VBD; survey/NN; vice/NN; loathe/NN; virtuoso/NN; verbatim/NN; epigrammatic/JJ; eucre/NN; farfetched/VBD; bookplate/JJ; afforest/JJS; lily/RB; bloomington/NN; maroon/NN; cloud/NN; turnkey/NN; cloakroom/NN; condemnatory/NN; oblivious/JJ; profound/NN; curious/JJ; declivity/NN; implant/NN; aid/NN; complementation/NN; cherubim/NN; serpent/NN; gleam/NN; scud/NN; casket/NN; scarborough/NN; testes/VBZ; actress/JJ; mawkish/JJ; beard/NN; mace/NN; shutoff/NN; wooster/NN; score/NN; minnesota/JJ; sovereignty/NN; efface/NN; sixteenth/JJ; commendatory/NN; digestive/JJ; aliquot/NN; backplane/NN; bluestocking/VBG; blumenthal/JJ; accent/JJ; desolater/NN; freed/VBD; problematic/JJ; dutch/NN; stab/NN; depose/JJ; trigonometry/NN; quetzal/NN; accra/NN; bel/NN; psychophysic/JJ; surplus/NN; ceylon/NN; fleawort/NN; autocollimate/NN; bloom/NN; arraign/NN; slid/VBD; inextinguishable/JJ; prexy/NN; gel/NN; pivotal/JJ; olin/NN; faraday/JJ; editorial/NN; ir/NN; davidson/NN; mckee/NN; placater/NN; damon/NN; babysat/VBD; megalomania/NNP; dalzell/NNP; nightgown/RB; moe/VBD; surrender/NN; maitre/NN; bantam/NN; sturgeon/VBD; tetragonal/JJ; clearheaded/JJ; assassinate/NN; insufficient/NN; stiff/NN; repugnant/NN; bradshaw/NN; parliament/NN; july/NN; navy/JJ; threesome/NN; you/PRP; '/''; d/JJ; revive/JJ; china/NN; cb/NN; retribution/NN; elastic/JJ; constellate/NN; kaleidescope/NN; sleight/VBD; adverb/JJ; chaos/NN; thetis/NN; discipline/NN; jill/NN; counterpoint/NN; ditty/JJ; horseflesh/JJ; obscure/NN; bartender/NN; close/JJ; curry/NN; posse/NN; nsf/NN; ave/VBP; effete/JJ; leave/VBP; disdainful/JJ; sonoma/NN; belgrade/VBD; men/NNS; headwater/RBR; medea/NN; vivian/JJ; thirty/NN; comic/JJ; bridgework/NN; column/NN; chamomile/NN; conscription/NN; arrack/NN; denumerable/JJ; cognate/NN; bedside/NN; constipate/NN; maureen/NN; tenant/VBP; tremulous/JJ; belladonna/NN; carpentry/NN; lithology/NN; hog/JJ; demand/NN; transferred/VBD; playa/JJ; parley/NN; fell/VBD; hackle/JJ; osmium/NN; delaware/NN; bust/JJ; literal/JJ; courteous/JJ; linen/NN; bedimmed/VBD; collagen/JJ; pulley/NN; taurus/NN; affect/VBP; unbidden/JJ; clayton/NN; croix/NN; agenda/NN; earthshaking/VBG; gradual/JJ; sidearm/NN; crystal/NN; terpsichorean/JJ; gamut/NN; trifluouride/IN; midterm/JJ; practical/JJ; domesticate/NN; bran/NN; journalese/JJ; ovate/NN; kovacs/NN; pivotal/JJ; trail/NN; camilla/NN; armoire/NN; attune/NN; anatomy/JJ; ethic/JJ; emerson/NN; sing/VBG; asbestos/NN; premonitory/JJ; toilet/NN; gary/JJ; sunrise/NN; bugging/NN; broomcorn/NN; fraud/NN; billet/NN; claude/NN; immediacy/NN; cutworm/NN; debugging/VBG; dopant/JJ; suave/NN; hind/NN; handwrite/JJ; hour/NN; landau/NN; atypic/NN; seismography/NN; outermost/FW; eldon/FW; emerge/VBP; carton/JJ; vivace/NN; clifton/NN; enormous/JJ; amy/NN; reclamation/NN; shrimp/NN; clatter/NN; basalt/NN; jablonsky/JJ; alumina/NN; hydrophobic/NN; rufus/NN; dora/NNS; gilead/VBP; argo/IN; youth/NN; meniscus/NN; wood/NN; bulk/NN; industry/NN; alia/VBZ; eugene/JJ; didactic/JJ; topmost/NN; draftsman/NN; halve/VB; dally/RB; consistent/JJ; declarative/JJ; bandit/NN; cypriot/NN; douglas/NNS; sown/JJ; fungus/JJ; interdict/JJ; astronomic/JJ; provoke/NN; tailwind/NN; endgame/NN; washbowl/NN; chiropractor/NN; rare/JJ; fateful/JJ; ellis/NN; polymeric/JJ; cervantes/NNS; salina/VBP; badinage/NN; bearish/JJ; pragmatist/NN; confirmation/NN; wyoming/VBG; laud/NN; enclave/VBP; nominee/JJ; equilateral/JJ; fatal/NN",N/A,-0.9542,-3.28,0,0,0,0,0,0,5,0,0,0,0,4,13,10,8,2,0,0,0,0,1,0,0,0,0,0,0,0,0,0,0,0,Unknown
150,0,0,8,17.75,7,N/A,car financing: 2; credit cards: 2; ( 866: 2; 866 ): 2; ) 361: 2,3,False,39,N/A,False,0.7133333333333334,"the/DT; fastest/JJS; way/NN; to/TO; get/VB; a/DT; loan/NN; we/PRP; can/MD; help/VB; !/.; since/IN; 1965/CD; redbrick/NN; lending/NN; has/VBZ; been/VBN; here/RB; for/IN; you/PRP; ./.; with/IN; our/PRP$; recent/JJ; reopening/NN; in/IN; addition/NN; to/TO; our/PRP$; launch/NN; of/IN; car/NN; financing/NN; and/CC; credit/NN; card/NN; services/NNS; ,/,; we/PRP; are/VBP; now/RB; able/JJ; to/TO; offer/VB; you/PRP; a/DT; full/JJ; range/NN; of/IN; services/NNS; from/IN; credit/NN; cards/NNS; to/TO; mortgages/NNS; ./.; */VB; credit/NN; cards/NNS; secured/VBD; or/CC; unsecured/JJ; */NN; business/NN; and/CC; personal/JJ; large/JJ; or/CC; small/JJ; */JJ; debt/NN; consolidation/NN; good/JJ; or/CC; bad/JJ; credit/NN; */NN; car/NN; financing/NN; */$; 1/CD; st/NN; or/CC; 2/CD; nd/JJ; mortgage/NN; no/DT; application/NN; will/MD; be/VB; refused/VBN; call/NN; today/NN; (/(; 866/CD; )/); 361/CD; -/:; 5036/CD; or/CC; (/(; 866/CD; )/); 361/CD; -/:; 5038/CD; or/CC; visit/VB; us/PRP; online/VB; at/IN; www/NN; ./.; redbricklending/VBG; ./.; biz/NN; proud/JJ; member/NN; of/IN; the/DT; bbb/NN; red/JJ; brick/NN; lending/NN; 14120/CD; ballantyne/NN; corp/NN; ./.; place/NN; ste/NN; ./.; #/#; 200/CD; charlotte/NN; ,/,; nc/RB; 28277/CD; this/DT; e/NN; -/:; mail/NN; message/NN; is/VBZ; an/DT; advertisement/NN; and/CC; //NN; or/CC; solicitation/NN; ./.",N/A,0.8439,67.08,1,0,1,0,0,0,0,2,2,5,0,2,3,7,1,0,0,0,0,0,0,0,0,0,0,0,0,0,0,0,0,0,Unknown
13,0,0,1,14.0,1,N/A,Could you: 1; you please: 1; please send: 1; send the: 1; the address: 1,0,False,0,N/A,False,1.0,Could/NNP; you/PRP; please/VBP; send/VB; the/DT; address/NN; of/IN; your/PRP$; agent/NN; in/IN; Saudi/NNP; Arabia.Thanks/NNP; Sathar/NNP,N/A,0.3182,83.66,0,0,0,0,0,0,0,0,0,0,0,0,0,1,0,0,0,0,0,0,0,0,0,0,0,0,0,0,0,0,0,0,Unknown
468,0,0,11,43.27272727272727,6,N/A,-- --: 12; * *: 8; Executive Guild: 7; International Executive: 6; < =: 5,60,False,135,N/A,False,0.6944444444444444,"This/DT; is/VBZ; a/DT; MIME/JJ; Message/NN; --/:; --/:; --/:; =_NextPart_000_007F_01BDF6C7.FABAC1B0/JJ; Content-Type/JJ; :/:; multipart/alternative/NN; ;/:; boundary=/NN; ''/''; --/:; --/:; =_NextPart_001_0080_01BDF6C7.FABAC1B0/NN; ''/''; --/:; --/:; --/:; =_NextPart_001_0080_01BDF6C7.FABAC1B0/JJ; Content-Type/JJ; :/:; text/plain/NN; ;/:; charset=/NN; ''/''; iso-8859-1/JJ; ''/''; Content-Transfer-Encoding/NN; :/:; quoted-printable/JJ; */NNP; */NNP; */NNP; */NNP; */NNP; This/DT; is/VBZ; an/DT; HTML/JJ; Message/NN; !/.; */JJ; */JJ; */NN; */NNP; */NNP; --/:; --/:; --/:; =_NextPart_001_0080_01BDF6C7.FABAC1B0/JJ; Content-Type/JJ; :/:; text/html/NN; ;/:; charset=/NN; ''/''; iso-8859-1/JJ; ''/''; Content-Transfer-Encoding/NN; :/:; quoted-printable/JJ; Executive/NNP; Guild/NNP; Membership/NNP; ApplicationResponse-O-Matic/JJ; FormDear/NNP; Candidate/NNP; ,/,; =A0/NNP; You/PRP; have/VBP; been/VBN; selected/VBN; as/IN; a/DT; potential/JJ; candidate/NN; for/IN; a/DT; free/JJ; listing/NN; in=A0/NN; </NNP; =/NNP; br/NN; >/VBD; the/DT; 2001/CD; Edition/NN; of/IN; the/DT; International/NNP; Executive/NNP; Guild/NNP; Registry=2E=A0=/NNP; Please/NNP; accept/VB; our/PRP$; congratulations/NNS; for/IN; this/DT; coveted/JJ; honor=2E=A0/NN; As/IN; this/DT; edition/NN; is/VBZ; so/RB; important/JJ; in/IN; view/NN; of/IN; the/DT; new/JJ; millennium/NN; ,/,; the=A0=/JJ; International/NNP; Executive/NNP; Guild/NNP; Registry/NNP; will/MD; be/VB; published/VBN; in/IN; two/CD; different=/NN; =A0/NN; formats/NNS; ;/:; the/DT; searchable/JJ; CD-ROM/NNP; and/CC; the/DT; Online/NNP; Registry=2E=A0/NNP; Since/IN; inclusion/NN; can/MD; be/VB; considered/VBN; recognition/NN; of/IN; your/PRP$; career/NN; position=A0/NN; </NNP; =/NNP; br/NN; >/NN; and/CC; professionalism/NN; ,/,; each/DT; candidate/NN; is/VBZ; evaluated/VBN; in/IN; keeping/VBG; with/IN; high=A0/NN; </NNP; =/NNP; br/NN; >/NN; standards/NNS; of/IN; individual/JJ; achievement=2E/NN; In/IN; light/NN; of/IN; this/DT; ,/,; the/DT; Internationa=/NNP; l/NN; Executive/NNP; Guild/NNP; thinks/VBZ; that/IN; you/PRP; may/MD; make/VB; an/DT; interesting/JJ; biographical/JJ; subject=2E=A0/NN; </NNP; =/NNP; br/NN; >/NN; We/PRP; look/VBP; forward/RB; to/TO; your/PRP$; inclusion/NN; and/CC; appearance/NN; in/IN; the/DT; International=A0/NNP; </NNP; =/NNP; br/NN; >/NNP; Executive/NNP; Guild/NNP; 's/POS; Registry=2E/NNP; Best/NNP; wishes/NNS; for/IN; your/PRP$; continued/JJ; success=2E=A0=/JJ; International/NNP; Executive/NNP; Guild=A0/NNP; Listing/NNP; Dept=2E=A0If/NNP; you/PRP; wish/VBP; to/TO; be/VB; removed/VBN; from/IN; our/PRP$; list/NN; ,/,; please/VB; submit/VB; your/PRP$; request/NN; at/IN; the/DT; bottom/NN; of/IN; this/DT; email=2E/JJ; </NN; !/.; --/:; function/NN; validate_form/NN; (/(; )/); {/(; validity/NN; =3D/NNP; true/JJ; ;/:; ///JJ; assume/VBP; valid/JJ; if/IN; (/(; !/.; check_empty/NN; (/(; document=2Eform=2Ebusphone=2Evalue/JJ; )/); )/); {/(; validity/NN; =3D/NNP; false/RB; ;/:; alert/NN; (/(; 'Day/JJ; Time/NNP; Phone/NNP; field/NN; is/VBZ; empty/JJ; !/.; '/''; )/); ;/:; }/); if/IN; (/(; validity/NN; )/); alert/NN; (/(; ``/``; Thank/NNP; you/PRP; for/IN; your/PRP$; registration/NN; !/.; ``/``; +/JJ; ``/``; Your/PRP$; form/NN; is/VBZ; now/RB; being/VBG; passed/VBN; to/TO; your/PRP$; browser/NN; 's/POS; ``/``; +/FW; ``/``; Mail/NNP; Delivery/NNP; Sub-System/NNP; for/IN; NORMAL/NNP; ''/''; +/VBZ; ``/``; NON-ENCRYPTED/JJ; email/NN; delivery=2E/NN; ''/''; +/VBZ; ``/``; All/DT; email/NN; addresses/NNS; are/VBP; removed/VBN; from/IN; our/PRP$; system/NN; ''/''; +/VBZ; ``/``; upon/IN; registration=2E/JJ; Please/NNP; click/NN; OK/NNP; to/TO; proceed/VB; ''/''; )/); ;/:; return/VB; validity/NN; ;/:; }/); function/NN; check_empty/NNS; (/(; text/NN; )/); {/(; return/NN; (/(; text=2Elength/JJ; >/NNP; 0/CD; )/); ;/:; ///CC; returns/NNS; false/JJ; if/IN; empty/JJ; }/); ///FW; --/:; >/JJ; International/NNP; Executive/NNP; Guild/NNP; Registration/NNP; Form/NNP; (/(; US/NNP; and/CC; Canada/NNP; Only/NNP; )/); Please/NNP; fill/VB; out/RP; this/DT; form/NN; if/IN; you/PRP; would/MD; like/VB; to/TO; be/VB; included/VBN; on/IN; The/DT; International/NNP; Executive/NNP; Guild/NNP; ,/,; For/IN; accuracy/NN; and/CC; publication/NN; purposes/NNS; ,/,; please/VB; complete/JJ; and/CC; send/VB; this/DT; form/NN; at/IN; the/DT; earliest/JJS; opportunity=2E/NN; There/EX; is/VBZ; no/DT; charge/NN; or/CC; obligation/NN; to/TO; be/VB; listed/VBN; on/IN; The/DT; International/NNP; Executive/NNP; Guild=2EYour/NNP; NameYour/NNP; CompanyTitleAddressCityState/NNP; or/CC; ProvinceCountry/NNP; USACanada/NNP; ZIP/Postal/NNP; CodeDay/NNP; Time/NNP; Telephone/NNP; Home/NNP; Phone/NNP; (/(; Not/RB; To/TO; Be/VB; Published/VBN; )/); Email/NNP; TO/NNP; HELP/NNP; US/NNP; IN/NNP; CONSIDERING/NNP; YOUR/NNP; APPLICATION/NNP; ,/,; PLEASE/NNP; TELL/NNP; US/NNP; A/NNP; LITTLE/NNP; ABOUT/NNP; YOURSELF=2E=2E=2E/NNP; Your/PRP$; Business/NNP; (/(; Financial/NNP; Svcs/NNP; ,/,; Banking/NNP; ,/,; Computer/NNP; Hardware/NNP; ,/,; Software/NNP; ,/,; Professional/NNP; Svcs/NNP; ,/,; Chemicals/NNP; ,/,; Apparel/NNP; ,/,; Aerospace/NNP; ,/,; Food/NNP; ,/,; Government/NNP; ,/,; Utility/NNP; ,/,; etc=2E/NN; )/); Type/NN; of/IN; Organization/NNP; (/(; M=/NNP; fg/RB; ,/,; Dist/Wholesaler/NNP; ,/,; Retailer/NNP; ,/,; Law/NNP; Firm/NNP; ,/,; Investment/NNP; Bank/NNP; ,/,; Commercial/NNP; Bank/NNP; ,/,; University/NNP; ,/,; Financial/NNP; Consultants/NNPS; ,/,; Ad/NNP; Agency/NNP; ,/,; Contractor/NNP; ,/,; Broker/NNP; ,/,; etc=2E/NN; )/); Your/PRP$; Business/JJ; Expertise/NNP; (/(; Corp=2EMgmt/NNP; ,/,; Marketing/NNP; ,/,; Civil/NNP; Engineering/NNP; ,/,; Tax/NNP; Law/NNP; ,/,; Nuclear/NNP; Physics/NNP; ,/,; Database/NNP; Development/NNP; ,/,; Operations/NNP; ,/,; Pathologist/NNP; ,/,; Mortgage/NNP; Banking/NNP; ,/,; etc=2E/NN; )/); Major/NNP; Product/NNP; Line/NNP; (/(; Integrated/NNP; Circuits/NNP; ,/,; Commercial/NNP; Aircraft/NNP; ,/,; Adhesives/NNP; ,/,; Cosmetics/NNP; ,/,; Plastic/NNP; Components/NNP; ,/,; Snack/NNP; Foods/NNP; ,/,; etc=2E/NN; )/); Note/NN; :/:; Submitting/VBG; this/DT; form=/NN; will/MD; be/VB; made/VBN; by/IN; email/NN; ,/,; not/RB; by/IN; use/NN; ofֳ‚ֲ/NN; www=2Eֳ‚ֲ/JJ; Confirmation/NNP; of/IN; its/PRP$; de=/NN; livery/NN; is/VBZ; made/VBN; by/IN; browsing/VBG; your/PRP$; outgoing/VBG; mail=2EThank/NN; you/PRP; for/IN; filling/VBG; in/IN; this/DT; form/NN; ,/,; we/PRP; will/MD; contact/VB; you/PRP; with/IN; more/JJR; information=2E/JJ; List/NNP; Removal/NNP; Click/NNP; Here/RB; --/:; --/:; --/:; =_NextPart_001_0080_01BDF6C7.FABAC1B0/FW; --/:; --/:; --/:; --/:; =_NextPart_000_007F_01BDF6C7.FABAC1B0/NN; --/:",N/A,0.9927,-18.71,5,18,0,0,0,0,4,14,14,10,5,47,60,6,11,6,10,6,66,7,0,0,0,0,0,0,27,0,3,0,3,0,Unknown
93,0,0,8,10.625,8,N/A,". html: 3; dvd ,: 2; , music: 2; music ,: 2; , x: 2",7,False,6,N/A,False,0.45161290322580644,"down/RB; ./.; load/JJ; -/:; dvd/NN; ,/,; mp/NN; 3/CD; ,/,; music/NN; ,/,; play/VB; -/:; station/NN; ,/,; x/NNP; box/NN; ,/,; movies/NNS; still/RB; in/IN; theaters/NNS; ,/,; mature/NN; movies/NNS; ,/,; software/NN; download/SYM; -/:; -/:; movies/NNS; still/RB; in/IN; theaters/NNS; ,/,; mature/NN; movies/NNS; ,/,; software/NN; ,/,; dvd/NN; ,/,; music/NN; ,/,; x/NNP; box/VBZ; a/DT; must/MD; -/:; see/VB; -/:; http/NN; :/:; //JJ; //NNP; www/NN; ./.; ./.; com/NN; //JJ; crstms/NN; ./.; html/VB; no/DT; more/RBR; adz/RB; ,/,; thanks/NNS; :/:; -/:; http/NN; :/:; //JJ; //NNP; www/NN; ./.; ./.; com/NN; //JJ; crstms/NN; ./.; html/NN; //JJ; postmark/NN; ./.; html/NN; t/VBD; 309/CD; px/NN; 37/CD; chalky/NN; referred/VBD; tractor/NN",N/A,0.8393,86.74,0,0,0,0,0,0,0,0,0,0,0,13,7,8,7,3,0,0,0,0,0,0,0,0,0,0,0,0,0,0,0,0,Unknown
