Word Count,URL Count,Email Count,Sentence Count,Average Sentence Length,NumDots,UrlLength,Most Common Bigrams,NumDash,AtSymbol,NumNumericChars,RandomString,IpAddress,Lexical Diversity,POS Tags,Named Entities,Sentiment Score,Readability Score,!,"""",#,$,%,&,',(,),*,+,",",-,.,/,:,;,<,=,>,?,@,[,\,],^,_,`,{,|,},~
177,0,0,9,19.88888888888889,9,N/A,"E Corp: 6; will be: 3; your E: 3; February 15: 2; 15 ,: 2",0,False,14,N/A,False,0.655367231638418,"Dear/NNP; valued/VBN; E/NNP; Corp/NNP; customer/NN; ,/,; We/PRP; are/VBP; writing/VBG; to/TO; inform/VB; you/PRP; that/IN; E/NNP; Corp/NNP; will/MD; be/VB; requiring/VBG; all/DT; users/NNS; to/TO; update/VB; their/PRP$; account/NN; passwords/NNS; as/IN; part/NN; of/IN; a/DT; regular/JJ; security/NN; update/NN; ./.; Effective/JJ; February/NNP; 15/CD; ,/,; 2024/CD; ,/,; you/PRP; will/MD; be/VB; prompted/VBN; to/TO; create/VB; a/DT; new/JJ; password/NN; the/DT; next/JJ; time/NN; you/PRP; login/VBP; to/TO; your/PRP$; E/NNP; Corp/NNP; account/NN; ./.; Your/PRP$; old/JJ; password/NN; will/MD; no/RB; longer/RBR; work/NN; after/IN; this/DT; date/NN; ./.; For/IN; your/PRP$; security/NN; ,/,; your/PRP$; new/JJ; password/NN; must/MD; meet/VB; the/DT; following/JJ; requirements/NNS; :/:; Be/VB; at/IN; least/JJS; 8/CD; characters/NNS; long/RB; Contain/VBP; a/DT; mix/NN; of/IN; uppercase/NN; and/CC; lowercase/NN; letters/NNS; Have/VBP; at/IN; least/JJS; one/CD; number/NN; Not/RB; be/VB; the/DT; same/JJ; as/IN; any/DT; of/IN; your/PRP$; last/JJ; 5/CD; passwords/NNS; You/PRP; may/MD; reset/VB; your/PRP$; password/NN; now/RB; by/IN; visiting/VBG; our/PRP$; website/NN; at/IN; www.ecorp.com/newpassword/NN; or/CC; waiting/VBG; until/IN; your/PRP$; next/JJ; login/NN; when/WRB; you/PRP; will/MD; be/VB; automatically/RB; prompted/VBN; ./.; Please/VB; update/JJ; your/PRP$; E/NNP; Corp/NNP; password/NN; before/IN; February/NNP; 15/CD; ,/,; 2024/CD; to/TO; ensure/VB; continued/JJ; access/NN; to/TO; your/PRP$; account/NN; and/CC; services/NNS; ./.; Let/VB; us/PRP; know/VB; if/IN; you/PRP; have/VBP; any/DT; questions/NNS; or/CC; concerns/NNS; ./.; Thank/NNP; you/PRP; for/IN; your/PRP$; cooperation/NN; in/IN; keeping/VBG; your/PRP$; E/NNP; Corp/NNP; account/NN; secure/NN; ./.; Sincerely/RB; ,/,; [/VB; Your/PRP$; name/NN; ]/NNP; E/NNP; Corp/NNP; Customer/NNP; Service/NNP",N/A,0.9744,59.94,0,0,0,0,0,0,0,0,0,0,0,6,0,9,1,1,0,0,0,0,0,0,1,0,1,0,0,0,0,0,0,0
178,0,0,9,20.0,9,N/A,"E Corp: 6; will be: 3; your E: 3; February 15: 2; 15 ,: 2",0,False,14,N/A,False,0.6573033707865169,"Dear/NNP; valued/VBN; E/NNP; Corp/NNP; customer/NN; ,/,; {/(; }/); We/PRP; are/VBP; writing/VBG; to/TO; inform/VB; you/PRP; that/IN; E/NNP; Corp/NNP; will/MD; be/VB; requiring/VBG; all/DT; users/NNS; to/TO; update/VB; their/PRP$; account/NN; passwords/NNS; as/IN; part/NN; of/IN; a/DT; regular/JJ; security/NN; update/NN; ./.; Effective/JJ; February/NNP; 15/CD; ,/,; 2024/CD; ,/,; you/PRP; will/MD; be/VB; prompted/VBN; to/TO; create/VB; a/DT; new/JJ; password/NN; the/DT; next/JJ; time/NN; you/PRP; login/VBP; to/TO; your/PRP$; E/NNP; Corp/NNP; account/NN; ./.; Your/PRP$; old/JJ; password/NN; will/MD; no/RB; longer/RBR; work/NN; after/IN; this/DT; date/NN; ./.; For/IN; your/PRP$; security/NN; ,/,; your/PRP$; new/JJ; password/NN; must/MD; meet/VB; the/DT; following/JJ; requirements/NNS; :/:; Be/VB; at/IN; least/JJS; 8/CD; characters/NNS; long/RB; Contain/VBP; a/DT; mix/NN; of/IN; uppercase/NN; and/CC; lowercase/NN; letters/NNS; Have/VBP; at/IN; least/JJS; one/CD; number/NN; Not/RB; be/VB; the/DT; same/JJ; as/IN; any/DT; of/IN; your/PRP$; last/JJ; 5/CD; passwords/NNS; You/PRP; may/MD; reset/VB; your/PRP$; password/NN; now/RB; by/IN; visiting/VBG; our/PRP$; website/NN; at/IN; www.ecorp.com/newpassword/NN; or/CC; waiting/VBG; until/IN; your/PRP$; next/JJ; login/NN; when/WRB; you/PRP; will/MD; be/VB; automatically/RB; prompted/VBN; ./.; Please/VB; update/JJ; your/PRP$; E/NNP; Corp/NNP; password/NN; before/IN; February/NNP; 15/CD; ,/,; 2024/CD; to/TO; ensure/VB; continued/JJ; access/NN; to/TO; your/PRP$; account/NN; and/CC; services/NNS; ./.; Let/VB; us/PRP; know/VB; if/IN; you/PRP; have/VBP; any/DT; questions/NNS; or/CC; concerns/NNS; ./.; Thank/NNP; you/PRP; for/IN; your/PRP$; cooperation/NN; in/IN; keeping/VBG; your/PRP$; E/NNP; Corp/NNP; account/NN; secure/NN; ./.; Sincerely/RB; ,/,; [/VB; Your/PRP$; name/NN; ]/NNP; E/NNP; Corp/NNP; Customer/NNP; Service/NNP",N/A,0.9744,59.94,0,0,0,0,0,0,0,0,0,0,0,6,0,9,1,1,0,0,0,0,0,0,1,0,1,0,0,0,1,0,1,0
177,0,0,9,19.88888888888889,9,N/A,"E Corp: 6; will be: 3; your E: 3; February 15: 2; 15 ,: 2",0,False,14,N/A,False,0.655367231638418,"Dear/NNP; valued/VBN; E/NNP; Corp/NNP; customer/NN; ,/,; We/PRP; are/VBP; writing/VBG; to/TO; inform/VB; you/PRP; that/IN; E/NNP; Corp/NNP; will/MD; be/VB; requiring/VBG; all/DT; users/NNS; to/TO; update/VB; their/PRP$; account/NN; passwords/NNS; as/IN; part/NN; of/IN; a/DT; regular/JJ; security/NN; update/NN; ./.; Effective/JJ; February/NNP; 15/CD; ,/,; 2024/CD; ,/,; you/PRP; will/MD; be/VB; prompted/VBN; to/TO; create/VB; a/DT; new/JJ; password/NN; the/DT; next/JJ; time/NN; you/PRP; login/VBP; to/TO; your/PRP$; E/NNP; Corp/NNP; account/NN; ./.; Your/PRP$; old/JJ; password/NN; will/MD; no/RB; longer/RBR; work/NN; after/IN; this/DT; date/NN; ./.; For/IN; your/PRP$; security/NN; ,/,; your/PRP$; new/JJ; password/NN; must/MD; meet/VB; the/DT; following/JJ; requirements/NNS; :/:; Be/VB; at/IN; least/JJS; 8/CD; characters/NNS; long/RB; Contain/VBP; a/DT; mix/NN; of/IN; uppercase/NN; and/CC; lowercase/NN; letters/NNS; Have/VBP; at/IN; least/JJS; one/CD; number/NN; Not/RB; be/VB; the/DT; same/JJ; as/IN; any/DT; of/IN; your/PRP$; last/JJ; 5/CD; passwords/NNS; You/PRP; may/MD; reset/VB; your/PRP$; password/NN; now/RB; by/IN; visiting/VBG; our/PRP$; website/NN; at/IN; www.ecorp.com/newpassword/NN; or/CC; waiting/VBG; until/IN; your/PRP$; next/JJ; login/NN; when/WRB; you/PRP; will/MD; be/VB; automatically/RB; prompted/VBN; ./.; Please/VB; update/JJ; your/PRP$; E/NNP; Corp/NNP; password/NN; before/IN; February/NNP; 15/CD; ,/,; 2024/CD; to/TO; ensure/VB; continued/JJ; access/NN; to/TO; your/PRP$; account/NN; and/CC; services/NNS; ./.; Let/VB; us/PRP; know/VB; if/IN; you/PRP; have/VBP; any/DT; questions/NNS; or/CC; concerns/NNS; ./.; Thank/NNP; you/PRP; for/IN; your/PRP$; cooperation/NN; in/IN; keeping/VBG; your/PRP$; E/NNP; Corp/NNP; account/NN; secure/NN; ./.; Sincerely/RB; ,/,; [/VB; Your/PRP$; name/NN; ]/NNP; E/NNP; Corp/NNP; Customer/NNP; Service/NNP",N/A,0.9744,59.94,0,0,0,0,0,0,0,0,0,0,0,6,0,9,1,1,0,0,0,0,0,0,1,0,1,0,0,0,0,0,0,0
1,0,0,0,0,0,N/A,,0,False,0,N/A,False,1.0,sdas/NNS,N/A,0.0,121.22,0,0,0,0,0,0,0,0,0,0,0,0,0,0,0,0,0,0,0,0,0,0,0,0,0,0,0,0,0,0,0,0
120,0,1,19,6.684210526315789,19,19,"Builder ID: 4; '' ל: 3; , Inc.: 3; הדוא '': 2; ה-AWS Builder: 2",7,False,21,N/A,False,0.8083333333333333,"</JJ; https/NN; :/:; //us-east-1.signin.aws/assets/static/img/AWS_logo_RGB_REV.png/JJ; >/NNP; אימות/NNP; כתובת/NNP; הדוא/NNP; ''/''; ל/NN; של/VBD; ה-AWS/JJ; Builder/NNP; ID/NNP; שלום/NNP; ,/,; תודה/NNP; על/NNP; כך/NNP; שהתחלת/NNP; להשתמש/NNP; ב-AWS/JJ; Builder/NNP; ID/NNP; !/.; ה-AWS/JJ; Builder/NNP; ID/NNP; הוא/NNP; פרופיל/NNP; אישי/NNP; חדש/NNP; למפתחים/NNP; ./.; אנחנו/VB; רוצים/JJ; לוודא/NNP; שאכן/NNP; מדובר/NNP; בך/NNP; ./.; יש/VB; להזין/JJ; את/NNP; קוד/NNP; האימות/NNP; הבא/NNP; ./.; אם/VB; לא/JJ; ביקשת/NNP; ליצור/NNP; AWS/NNP; Builder/NNP; ID/NNP; ,/,; אפשר/NNP; להתעלם/NNP; מהודעת/NNP; הדוא/NNP; ''/''; ל/NN; הזו/NNP; ./.; קוד/CC; האימות/JJ; :/:; 202144/CD; תוקפו/NN; של/NNP; קוד/NNP; זה/NNP; יפוג/VBD; 10/CD; דקות/NNP; אחרי/NNP; שהוא/NNP; נשלח/NNP; ./.; לעולם/VB; לא/JJ; תישלח/NNP; לך/NNP; הודעת/NNP; דוא/NNP; ''/''; ל/VBZ; מ-AWS/JJ; עם/NNP; בקשה/NNP; לחשוף/NNP; או/NNP; לאמת/NNP; את/NNP; הסיסמה/NNP; שלך/NNP; ,/,; את/NNP; כרטיס/NNP; האשראי/NNP; או/NNP; את/NNP; מספר/NNP; חשבון/NNP; הבנק/NNP; ./.; Amazon/NNP; Web/NNP; Services/NNP; ,/,; Inc./NNP; היא/NNP; חברה/NNP; בת/NNP; של/NNP; Amazon.com/NNP; ,/,; Inc/NNP; ../NNP; Amazon.com/NNP; הוא/NNP; סימן/NNP; מסחרי/NNP; רשום/NNP; של/NNP; Amazon.com/NNP; ,/,; Inc./NNP; מודעה/NNP; זו/NNP; נוצרה/NNP; והופצה/NNP; על/NNP; ידי/NNP; Amazon/NNP; Web/NNP; Services/NNP; ,/,; Inc./NNP; ,/,; 410/CD; Terry/NNP; Ave./NNP; North/NNP; ,/,; Seattle/NNP; ,/,; WA/NNP; 98109-5210/CD; ./.",N/A,0.4003,95.98,1,3,0,0,0,0,0,0,0,0,0,10,7,19,6,2,0,1,0,1,0,0,0,0,0,0,3,0,0,0,0,0
2,0,0,0,0,0,N/A,fdsfdsf sdf: 1,0,False,0,N/A,False,1.0,fdsfdsf/NN; sdf/NN,N/A,0.0,120.21,0,0,0,0,0,0,0,0,0,0,0,0,0,0,0,0,0,0,0,0,0,0,0,0,0,0,0,0,0,0,0,0
1,0,0,0,0,0,N/A,,0,False,0,N/A,False,1.0,werwe/NN,N/A,0.0,36.62,0,0,0,0,0,0,0,0,0,0,0,0,0,0,0,0,0,0,0,0,0,0,0,0,0,0,0,0,0,0,0,0
1,0,0,0,0,0,N/A,,0,False,0,N/A,False,1.0,werwews/NNS,N/A,0.0,36.62,0,0,0,0,0,0,0,0,0,0,0,0,0,0,0,0,0,0,0,0,0,0,0,0,0,0,0,0,0,0,0,0
96,0,0,11,9.090909090909092,36,N/A,I am: 4; for you: 2; Hello I: 1; am your: 1; your hot: 1,14,False,29,N/A,False,0.8229166666666666,"Hello/NNP; I/PRP; am/VBP; your/PRP$; hot/JJ; lil/JJ; horny/NN; toy/NN; ./.; I/PRP; am/VBP; the/DT; one/NN; you/PRP; dream/VBP; About/IN; ,/,; I/PRP; am/VBP; a/DT; very/RB; open/JJ; minded/VBD; person/NN; ,/,; Love/NNP; to/TO; talk/VB; about/IN; and/CC; any/DT; subject/NN; ./.; Fantasy/NNP; is/VBZ; my/PRP$; way/NN; of/IN; life/NN; ,/,; Ultimate/NNP; in/IN; sex/NN; play/NN; ./.; Ummmmmmmmmmmmmm/NNP; I/PRP; am/VBP; Wet/NNP; and/CC; ready/JJ; for/IN; you/PRP; ./.; It/PRP; is/VBZ; not/RB; your/PRP$; looks/NNS; but/CC; your/PRP$; imagination/NN; that/IN; matters/VBZ; most/RBS; ,/,; With/IN; My/NNP; sexy/JJ; voice/NN; I/PRP; can/MD; make/VB; your/PRP$; dream/NN; come/VB; true/JJ; .../:; Hurry/NNP; Up/NNP; !/.; call/VB; me/PRP; let/VB; me/PRP; Cummmmm/VB; for/IN; you/PRP; ........................../VBP; TOLL-FREE/JJ; :/:; 1-877-451-TEEN/JJ; (/(; 1-877-451-8336/JJ; )/); For/IN; phone/NN; billing/NN; :/:; 1-900-993-2582/JJ; --/:; _______________________________________________/JJ; Sign-up/NNP; for/IN; your/PRP$; own/JJ; FREE/JJ; Personalized/VBN; E-mail/NN; at/IN; Mail.com/NNP; http/NN; :/:; //www.mail.com//NN; ?/.; sr=signup/NN",N/A,0.964,74.59,1,0,0,0,0,0,0,1,1,0,0,4,14,36,3,3,0,0,1,0,1,0,0,0,0,0,47,0,0,0,0,0,Unknown
91,0,0,13,6.0,13,N/A,software at: 1; at incredibly: 1; incredibly low: 1; low prices: 1; prices (: 1,0,False,2,N/A,False,0.7142857142857143,"software/NN; at/IN; incredibly/RB; low/JJ; prices/NNS; (/(; 86/CD; %/NN; lower/JJR; )/); ./.; drapery/NN; seventeen/JJ; term/NN; represent/VBP; any/DT; sing/NN; ./.; feet/NNS; wild/JJ; break/NN; able/JJ; build/NN; ./.; tail/NN; ,/,; send/VBP; subtract/JJ; represent/NN; ./.; job/NN; cow/JJ; student/NN; inch/NN; gave/VBD; ./.; let/NN; still/RB; warm/VB; ,/,; family/NN; draw/NN; ,/,; land/NN; book/NN; ./.; glass/NN; plan/NN; include/VBP; ./.; sentence/NN; is/VBZ; ,/,; hat/WP; silent/VBD; nothing/NN; ./.; order/NN; ,/,; wild/VBP; famous/JJ; long/RB; their/PRP$; ./.; inch/NN; such/JJ; ,/,; saw/VBD; ,/,; person/NN; ,/,; save/VBP; ./.; face/NN; ,/,; especially/RB; sentence/JJ; science/NN; ./.; certain/JJ; ,/,; cry/NN; does/VBZ; ./.; two/CD; depend/JJ; yes/NNS; ,/,; written/VBN; carry/NN; ./.",N/A,0.0534,74.96,0,0,0,0,1,0,0,1,1,0,0,11,0,13,0,0,0,0,0,0,0,0,0,0,0,0,0,0,0,0,0,0,Unknown
1384,0,0,56,23.714285714285715,49,N/A,", ``: 9; genex pharmaceutical: 8; of this: 7; of the: 6; ' s: 6",11,False,130,N/A,False,0.4342485549132948,"entourage/NN; ,/,; stockmogul/NN; newsletter/NN; ralph/NN; velez/NN; ,/,; genex/JJ; pharmaceutical/JJ; ,/,; inc/NN; ./.; (/(; otcbb/JJ; :/:; genx/NN; )/); biotech/NN; sizzle/NN; with/IN; sales/NNS; and/CC; earnings/NNS; !/.; treating/VBG; bone/NN; related/JJ; injuries/NNS; in/IN; china/NN; revenues/NNS; three/CD; months/NNS; ended/VBD; june/NN; 30/CD; ,/,; 2004/CD; :/:; $/$; 525/CD; ,/,; 750/CD; vs/NN; ./.; $/$; 98/CD; ,/,; 763/CD; year/NN; ago/RB; period/NN; net/JJ; income/NN; three/CD; months/NNS; ended/VBD; june/NN; 30/CD; ,/,; 2004/CD; :/:; $/$; 151/CD; ,/,; 904/CD; vs/NN; ./.; (/(; $/$; 23/CD; ,/,; 929/CD; )/); year/NN; ago/RB; period/NN; (/(; source/NN; :/:; 10/CD; q/NN; 8/CD; //NN; 16/CD; //$; 04/CD; )/); look/VB; how/WRB; these/DT; chinese/JJ; companies/NNS; trading/VBG; in/IN; the/DT; usa/NN; did/VBD; and/CC; what/WP; they/PRP; would/MD; '/''; ve/NNS; made/VBN; your/PRP$; portfolio/NN; look/NN; like/IN; if/IN; you/PRP; had/VBD; the/DT; scoop/NN; on/IN; them/PRP; :/:; (/(; big/JJ; money/NN; was/VBD; made/VBN; in/IN; these/DT; stocks/NNS; by/IN; savvy/JJ; investors/NNS; who/WP; timed/VBD; them/PRP; right/RB; )/); (/(; otcbb/JJ; :/:; caas/NN; )/); :/:; closed/VBD; september/RB; 2/CD; ,/,; 2003/CD; at/IN; $/$; 4/CD; ./.; 00/CD; ./.; closed/VBD; december/NN; 31/CD; ,/,; 2003/CD; :/:; $/$; 16/CD; ./.; 65/CD; ,/,; up/RB; 316/CD; %/NN; otcbb/NN; :/:; cwtd/NN; )/); :/:; closed/VBD; january/JJ; 30/CD; ,/,; 2004/CD; at/IN; $/$; 1/CD; ./.; 50/CD; ./.; closed/VBD; february/JJ; 17/CD; th/NN; at/IN; $/$; 7/CD; ./.; 90/CD; ,/,; up/RB; 426/CD; %/NN; ordinary/JJ; investors/NNS; like/IN; you/PRP; are/VBP; getting/VBG; filthy/JJ; ,/,; stinking/VBG; ri/NN; '/''; ch/NN; in/IN; tiny/JJ; stocks/NNS; no/DT; one/NN; has/VBZ; ever/RB; heard/VBN; of/IN; until/IN; now/RB; ./.; this/DT; biotech/NN; bad/JJ; boy/NN; (/(; genx/NN; )/); is/VBZ; already/RB; out/IN; of/IN; stealth/NN; mode/NN; and/CC; is/VBZ; top/JJ; line/NN; revenue/NN; producing/VBG; !/.; do/VB; you/PRP; see/VB; where/WRB; we/PRP; '/''; re/VBZ; going/VBG; with/IN; this/DT; ?/.; biotech/NN; sizzle/NN; with/IN; sales/NNS; and/CC; earnings/NNS; !/.; about/IN; genex/JJ; pharmaceutical/JJ; ,/,; inc/NN; ./.; (/(; product/NN; distribtued/VBN; to/TO; 400/CD; hospitals/NNS; in/IN; 22/CD; provinces/NNS; )/); genex/VBP; pharmaceutical/JJ; ,/,; inc/NN; ./.; is/VBZ; a/DT; biomedical/JJ; technology/NN; company/NN; with/IN; distinctive/JJ; proprietary/JJ; technology/NN; for/IN; an/DT; orthopedic/JJ; device/NN; that/IN; treats/VBZ; bone/SYM; -/:; related/JJ; injuries/NNS; ./.; headquartered/VBN; in/IN; tianjin/NN; ,/,; china/NN; ,/,; the/DT; company/NN; manufactures/VBZ; and/CC; distributes/VBZ; reconstituted/VBN; bone/NN; xenograft/NN; (/(; rbx/NN; )/); ,/,; to/TO; 400/CD; hospitals/NNS; in/IN; 22/CD; provinces/NNS; throughout/IN; mainland/JJ; china/NN; ./.; rbx/NN; is/VBZ; approved/VBN; by/IN; the/DT; state/NN; food/NN; and/CC; drug/NN; administration/NN; (/(; sfda/JJ; )/); in/IN; china/NN; (/(; the/DT; chinese/JJ; government/NN; agency/NN; that/WDT; regulates/VBZ; drugs/NNS; and/CC; medical/JJ; devices/NNS; )/); ./.; rbx/NN; offers/VBZ; a/DT; modern/JJ; alternative/NN; to/TO; traditional/JJ; methods/NNS; of/IN; treating/VBG; orthopedic/JJ; injuries/NNS; ./.; (/(; source/NN; :/:; news/NN; release/NN; 7/CD; //NN; 27/CD; //$; 04/CD; )/); recent/JJ; press/NN; release/NN; headlines/NNS; :/:; (/(; new/JJ; product/NN; tested/VBN; and/CC; large/JJ; acquisition/NN; in/IN; the/DT; works/NN; !/.; )/); */VBP; genex/JJ; pharmaceutical/JJ; adopts/NNS; new/JJ; proprietary/JJ; technology/NN; ,/,; substantially/RB; reduces/VBZ; manufacturing/NN; costs/NNS; ,/,; sees/NNS; positive/JJ; impact/NN; to/TO; earnings/NNS; */NNP; genex/RB; pharmaceutical/JJ; signs/NNS; letter/NN; of/IN; intent/NN; to/TO; acquire/VB; one/CD; of/IN; the/DT; world/NN; '/POS; s/NN; largest/JJS; producers/NNS; of/IN; vitamin/NN; bl/NN; */NNP; genex/NN; pharmaceutical/JJ; sees/NNS; strong/JJ; earnings/NNS; growth/NN; for/IN; 2004/CD; and/CC; 2005/CD; */NNP; genex/VBD; pharmaceutical/JJ; 2/CD; nd/JJ; quarter/NN; revenue/NN; up/RB; 432/CD; %/NN; ,/,; gross/JJ; profit/NN; up/RB; 380/CD; %/NN; ,/,; net/JJ; income/NN; soars/NNS; ,/,; sees/NNS; continued/VBD; earnings/NNS; momentum/NN; for/IN; remainder/NN; of/IN; 2004/CD; */NNP; genex/VBD; pharmaceutical/JJ; '/''; s/JJ; micro/SYM; -/:; particle/NN; rbx/VBZ; medical/JJ; product/NN; expands/VBZ; to/TO; the/DT; dental/JJ; markets/NNS; */RB; could/MD; this/DT; be/VB; a/DT; ``/``; rising/JJ; star/NN; stock/NN; ``/``; for/IN; your/PRP$; portfolio/NN; ?/.; you/PRP; may/MD; easily/RB; agree/VB; that/IN; the/DT; company/NN; is/VBZ; doing/VBG; some/DT; dynamic/JJ; things/NNS; ./.; some/DT; of/IN; these/DT; small/JJ; stocks/NNS; have/VBP; absolutely/RB; exploded/VBN; in/IN; price/NN; recently/RB; ./.; */IN; you/PRP; may/MD; want/VB; to/TO; consider/VB; the/DT; ``/``; chinese/JJ; fortune/NN; cookie/NN; ``/``; strategy/NN; :/:; rising/VBG; star/NN; chinese/JJ; companies/NNS; trading/VBG; in/IN; the/DT; us/PRP; ./.; ./.; consider/VB; adding/VBG; genx/NN; to/TO; your/PRP$; portfolio/NN; today/NN; !/.; dis/NN; -/:; claimer/NN; :/:; information/NN; within/IN; this/DT; ema/JJ; -/:; il/NN; contains/VBZ; ``/``; forward/RB; looking/VBG; statements/NNS; ``/``; within/IN; the/DT; meaning/NN; of/IN; section/NN; 27/CD; a/DT; of/IN; the/DT; securities/NNS; act/NN; of/IN; 1933/CD; and/CC; section/NN; 21/CD; b/NN; of/IN; the/DT; securities/NNS; exchange/NN; act/NN; of/IN; 1934/CD; ./.; any/DT; statements/NNS; that/WDT; express/VBP; or/CC; involve/VBP; discussions/NNS; with/IN; respect/NN; to/TO; predictions/NNS; ,/,; expectations/NNS; ,/,; beliefs/NNS; ,/,; plans/NNS; ,/,; projections/NNS; ,/,; objectives/NNS; ,/,; goals/NNS; ,/,; assumptions/NNS; or/CC; future/JJ; events/NNS; or/CC; performance/NN; are/VBP; not/RB; statements/NNS; of/IN; historical/JJ; fact/NN; and/CC; may/MD; be/VB; ``/``; forward/RB; looking/VBG; statements/NNS; ./.; ``/``; forward/RB; looking/VBG; statements/NNS; are/VBP; based/VBN; on/IN; expectations/NNS; ,/,; estimates/NNS; and/CC; projections/NNS; at/IN; the/DT; time/NN; the/DT; statements/NNS; are/VBP; made/VBN; that/IN; involve/VB; a/DT; number/NN; of/IN; risks/NNS; and/CC; uncertainties/NNS; which/WDT; could/MD; cause/VB; actual/JJ; results/NNS; or/CC; events/NNS; to/TO; differ/VB; materially/RB; from/IN; those/DT; presently/RB; anticipated/VBN; ./.; forward/RB; looking/VBG; statements/NNS; in/IN; this/DT; action/NN; may/MD; be/VB; identified/VBN; through/IN; the/DT; use/NN; of/IN; words/NNS; such/JJ; as/IN; ``/``; projects/NNS; ``/``; ,/,; ``/``; foresee/NN; ``/``; ,/,; ``/``; expects/VBZ; ``/``; ,/,; ``/``; will/MD; ,/,; ``/``; ``/``; anticipates/NNS; ,/,; ``/``; ``/``; estimates/NNS; ,/,; ``/``; ``/``; believes/VBZ; ,/,; ``/``; ``/``; understands/VBZ; ``/``; or/CC; that/DT; by/IN; statements/NNS; indicating/VBG; certain/JJ; actions/NNS; ``/``; may/MD; ,/,; ``/``; ``/``; could/MD; ,/,; ``/``; or/CC; ``/``; might/MD; ``/``; occur/VB; ./.; as/IN; with/IN; many/JJ; micro/NNS; -/:; cap/NN; stocks/NNS; ,/,; today/NN; '/POS; s/NN; company/NN; has/VBZ; additional/JJ; risk/NN; factors/NNS; worth/IN; noting/VBG; ./.; those/DT; factors/NNS; include/VBP; :/:; a/DT; limited/JJ; operating/NN; history/NN; :/:; the/DT; company/NN; advancing/VBG; cash/NN; to/TO; related/JJ; parties/NNS; and/CC; a/DT; shareholder/NN; on/IN; an/DT; unsecured/JJ; basis/NN; :/:; one/CD; vendor/NN; ,/,; a/DT; related/JJ; party/NN; through/IN; a/DT; majority/NN; stockholder/NN; ,/,; supplies/NNS; ninety/VBP; -/:; seven/CD; percent/NN; of/IN; the/DT; company/NN; '/POS; s/JJ; raw/JJ; materials/NNS; :/:; reliance/NN; on/IN; two/CD; customers/NNS; for/IN; over/IN; fifty/JJ; percent/NN; of/IN; their/PRP$; business/NN; and/CC; numerous/JJ; related/JJ; party/NN; transactions/NNS; and/CC; the/DT; need/NN; to/TO; raise/VB; capital/NN; ./.; these/DT; risk/NN; factors/NNS; and/CC; others/NNS; are/VBP; fully/RB; detailed/VBN; in/IN; the/DT; company/NN; '/POS; s/NN; sec/NN; filings/NNS; ./.; we/PRP; urge/VBP; you/PRP; to/TO; read/VB; them/PRP; before/IN; you/PRP; invest/VBP; ./.; the/DT; publisher/NN; of/IN; this/DT; letter/NN; does/VBZ; not/RB; represent/VB; that/IN; the/DT; information/NN; contained/VBN; in/IN; this/DT; message/NN; states/VBZ; all/DT; material/JJ; facts/NNS; or/CC; does/VBZ; not/RB; omit/VB; a/DT; material/JJ; fact/NN; necessary/JJ; to/TO; make/VB; the/DT; statements/NNS; therein/IN; not/RB; misleading/VBG; ./.; all/DT; information/NN; provided/VBD; within/IN; this/DT; ema/JJ; -/:; il/NN; pertaining/VBG; to/TO; investing/VBG; ,/,; stocks/NNS; or/CC; securities/NNS; must/MD; be/VB; understood/JJ; as/IN; information/NN; provided/VBD; and/CC; not/RB; investment/NN; advice/NN; ./.; the/DT; publisher/NN; of/IN; this/DT; letter/NN; advises/VBZ; all/DT; readers/NNS; and/CC; subscribers/NNS; to/TO; seek/VB; advice/NN; from/IN; a/DT; registered/JJ; professional/JJ; securities/NNS; representative/VBP; before/IN; deciding/VBG; to/TO; trade/VB; in/IN; stocks/NNS; featured/VBN; within/IN; this/DT; ema/JJ; -/:; il/NN; ./.; none/NN; of/IN; the/DT; material/NN; within/IN; this/DT; report/NN; shall/MD; be/VB; construed/VBN; as/IN; any/DT; kind/NN; of/IN; investment/NN; advice/NN; or/CC; solicitation/NN; ./.; many/JJ; of/IN; these/DT; companies/NNS; are/VBP; on/IN; the/DT; verge/NN; of/IN; bankruptcy/NN; ./.; you/PRP; can/MD; lose/VB; all/DT; your/PRP$; money/NN; by/IN; investing/VBG; in/IN; this/DT; stock/NN; ./.; the/DT; publisher/NN; of/IN; this/DT; letter/NN; is/VBZ; not/RB; a/DT; registered/JJ; investment/NN; advisor/NN; ./.; subscribers/NNS; should/MD; not/RB; view/VB; information/NN; herein/NN; as/IN; legal/JJ; ,/,; tax/NN; ,/,; accounting/NN; or/CC; investment/NN; advice/NN; ./.; any/DT; reference/NN; to/TO; past/VB; performance/NN; (/(; s/JJ; )/); of/IN; companies/NNS; are/VBP; specially/RB; selected/VBN; to/TO; be/VB; referenced/VBN; based/VBN; on/IN; the/DT; favorable/JJ; performance/NN; of/IN; these/DT; companies/NNS; ./.; you/PRP; would/MD; need/VB; perfect/JJ; timing/VBG; to/TO; acheive/VB; the/DT; results/NNS; in/IN; the/DT; examples/NNS; given/VBN; ./.; there/EX; can/MD; be/VB; no/DT; assurance/NN; of/IN; that/DT; happening/VBG; ./.; remember/VB; ,/,; as/IN; always/RB; ,/,; past/JJ; performance/NN; is/VBZ; never/RB; indicative/JJ; of/IN; future/JJ; results/NNS; and/CC; a/DT; thorough/JJ; due/JJ; diligence/NN; effort/NN; ,/,; including/VBG; a/DT; review/NN; of/IN; a/DT; company/NN; '/POS; s/NN; filings/NNS; ,/,; should/MD; be/VB; completed/VBN; prior/JJ; to/TO; investing/VBG; ./.; the/DT; publisher/NN; of/IN; this/DT; letter/NN; has/VBZ; no/DT; relationship/NN; with/IN; caas/NN; and/CC; cwtd/NN; ./.; (/(; source/NN; for/IN; price/NN; information/NN; :/:; yahoo/NN; finance/NN; historical/JJ; )/); ./.; in/IN; compliance/NN; with/IN; the/DT; securities/NNS; act/NN; of/IN; 1933/CD; ,/,; sectionl/VBD; 7/CD; (/(; b/NN; )/); ,/,; the/DT; publisher/NN; of/IN; this/DT; letter/NN; discloses/VBZ; the/DT; receipt/NN; of/IN; twenty/JJ; four/CD; thousand/CD; dollars/NNS; from/IN; a/DT; third/JJ; party/NN; ,/,; (/(; dmi/NN; ,/,; inc/NN; )/); not/RB; an/DT; officer/NN; ,/,; director/NN; or/CC; affiliate/NN; shareholder/NN; for/IN; the/DT; circulation/NN; of/IN; this/DT; report/NN; ./.; be/VB; aware/JJ; of/IN; an/DT; inherent/JJ; conflict/NN; of/IN; interest/NN; resulting/VBG; from/IN; such/JJ; compensation/NN; due/JJ; to/TO; the/DT; fact/NN; that/IN; this/DT; is/VBZ; a/DT; paid/VBN; adver/NN; -/:; tisement/NN; and/CC; is/VBZ; not/RB; without/IN; bias/NNS; ./.; all/DT; factual/JJ; information/NN; in/IN; this/DT; report/NN; was/VBD; gathered/VBN; from/IN; public/JJ; sources/NNS; ,/,; including/VBG; but/CC; not/RB; limited/VBD; to/TO; company/NN; websites/NNS; ,/,; sec/JJ; filings/NNS; and/CC; company/NN; press/NN; releases/NNS; ./.; the/DT; publisher/NN; of/IN; this/DT; letter/NN; believes/VBZ; this/DT; information/NN; to/TO; be/VB; reliable/JJ; but/CC; can/MD; make/VB; no/DT; guar/NN; -/:; antee/NN; as/IN; to/TO; its/PRP$; accuracy/NN; or/CC; completeness/NN; ./.; use/NN; of/IN; the/DT; material/NN; within/IN; this/DT; ema/JJ; -/:; il/NN; constitutes/VBZ; your/PRP$; acceptance/NN; of/IN; these/DT; terms/NNS; ./.; indemnity/NN; urbanite/JJ; fogy/NN; denude/NN; registrable/JJ; usia/JJ; pilfer/NN; ethylene/NN; pounce/NN; pisces/NNS; mutate/VBP; water/NN; dialect/NN; contrast/NN; seymour/NN; molest/JJS; commonality/NN; epidermic/JJ; liquefaction/NN; prom/IN; koenig/JJ; cookbook/NN; clio/NN; sixteenth/JJ; casteth/JJ; barrage/NN; borax/NN; told/VBD; irredeemable/JJ; desmond/NN; circle/NN; ,/,; finch/JJ; parch/NN; farkas/NN; fum/NN; arrogant/JJ; neumann/JJ; remission/NN; marten/NNS; countryside/VBP; silty/NN; bird/NN; placenta/NN; diphthong/JJ; crass/NN; typhoid/NN; eyesight/VBD; diatom/NN; extendible/JJ; clip/NN; midspan/NN; insomniac/JJ; continuation/NN; ./.; woebegone/NN; borealis/NN; pyramidal/JJ; brandish/JJ; sepal/NN; abnormal/JJ; career/NN; avertive/JJ; verdict/NN; bath/NN; collie/VBP; canal/JJ; rpm/NN; jolly/RB; primeval/JJ; wong/IN; dishwasher/RB; noose/JJ; magician/JJ; accentuate/NN; apparel/NN; apache/NN; aerogene/NN; palmetto/NN; halsey/NN; rosetta/NN; springy/NN; despot/NN; depend/VBP; sloe/JJ; cattleman/NN; beginner/NN; exorcise/NN; cranberry/NN; von/NN; dissonant/NN; ./.",N/A,0.936,41.09,5,30,0,8,4,0,9,16,17,7,0,60,11,49,4,19,0,0,0,0,2,0,0,0,0,0,0,0,0,0,0,0,Unknown
